author,author_fullname,created_utc,id,num_comments,permalink,score,selftext,subreddit,title,url,is_self
etcetcere,t2_3ut22b1m,1654086936,v2g028,1,/r/vegan/comments/v2g028/small_win_for_the_animals_lol_always_hoped_it/,1,,vegan,Small win for the animals lol always hoped it would wipeout demand in North America..,https://www.thestar.com/news/canada/2022/05/20/i-felt-like-i-was-going-to-die-ticks-that-cause-red-meat-allergy-are-in-canada.html,False
BirdofaParadise,t2_dg9unihv,1654089412,v2gt6o,0,/r/vegan/comments/v2gt6o/red_flag_even_if_you_dont_agree_offer_a/,1,,vegan,"Red flag??? Even if you don’t agree, offer a substantial argument other than hearsay?",https://i.redd.it/bqbm9ymhf0391.jpg,False
OppositeCrazy6511,t2_ayvsah41,1654090211,v2h2ee,1,/r/vegan/comments/v2h2ee/vegan_bibimbap/,1,,vegan,Vegan Bibimbap,http://muditaskitchen.com/vegan-bibimbap/,False
christinafoxx23,t2_fyy5vrhb,1654092670,v2hwwe,1,/r/vegan/comments/v2hwwe/good_mushroomfree_coffee_alternative/,1,"I’ve been drinking Four Sigmatic adaptogenic mushroom coffee for the past year, and just found out I’m highly sensitive to mushrooms… yay. Anyone know of a good mushroom-free coffee alternative?

For some context, regular coffee gives me the jitters really bad and I love how the adaptogens in the Four Sigmatic make me feel. Relaxed but awake and focused. I also love the flavor and ritual of coffee in the morning.

If there are no other options I guess I’d do regular decaf coffee but that’s no fun.",vegan,Good mushroom-free coffee alternative?,https://www.reddit.com/r/vegan/comments/v2hwwe/good_mushroomfree_coffee_alternative/,True
Specialist_Ad0,t2_9la2n5a0,1654093411,v2i6ck,0,/r/vegan/comments/v2i6ck/taking_steps_to_becoming_vegan/,1,[removed],vegan,Taking steps to becoming vegan,https://www.reddit.com/r/vegan/comments/v2i6ck/taking_steps_to_becoming_vegan/,True
Kosmosfriedhof,t2_4adwcqur,1654093736,v2iahj,1,/r/vegan/comments/v2iahj/whats_your_experience_with_b12_supplements_and/,1,"I'm rather new to this whole vegan thing (2 months) and got a question on the effect vitamin B12 supplements seem to have on my skin.

When i started being vegan i didnt supplement for the first month because i figured i still had enough B12 from my previous omnivore diet. Here my skin was the best i ever had in my life.

Then i started taking 300 micro gramms (one pill) of Vitamin B12 (cyanocobalamin) daily. The pimples came back. Not terrible akne but 2,3 pimples every other day. 

This made me curious and i stopped taking the supplement for 3 days. Pimples vanished. Amazing skin again.

Now i read that taking too much vitamin B12 can produce pimples and even lead to akne but on the other hand i'm still paranoid of not taking enough.

So how much B12 is enough and how much is too much? Do you have experience with other forms of taking B12? Anyone found a solution for the pimple problem?",vegan,What's your experience with B12 supplements and pimples?,https://www.reddit.com/r/vegan/comments/v2iahj/whats_your_experience_with_b12_supplements_and/,True
YourVeganFallacyIs,t2_myuzp,1654093842,v2ibvb,0,/r/vegan/comments/v2ibvb/jo_frederiks_is_an_amazing_artist_they_titled/,1,,vegan,"Jo Frederiks is an amazing artist; they titled this piece ""Shadow of Indifference""",https://i.redd.it/7auhzszos0391.jpg,False
monteirodecas,t2_7m1l3nv,1654094188,v2ig8i,0,/r/vegan/comments/v2ig8i/semi_vegetarian_followed_by_love_cats_hate_dumb/,1,,vegan,"""semi vegetarian"" followed by ""love cats, hate dumb people"" ahahahahahhaha",https://i.redd.it/bi9gpunqt0391.jpg,False
Anglerfishtendril,t2_ltlvcq2w,1654094594,v2ilaq,1,/r/vegan/comments/v2ilaq/question_about_honey_bees/,1,"So I’m seeing a lot of posts saying that honey bees are an invasive species and give things like diseases to native bees, I was a bit confused with how it was worded, since it seemed to say that the honey bees life is less valuable. so is the hope that one day the honey bees will be gone? Or are we supposed to be trying to help both kinds of bees? Sorry if this question is silly",vegan,Question about honey bees,https://www.reddit.com/r/vegan/comments/v2ilaq/question_about_honey_bees/,True
idonttrustmyself1,t2_3mq0g0fm,1654097714,v2jqrl,0,/r/vegan/comments/v2jqrl/made_okonomiyaki_and_soondubu_jjigae_w_soba/,1,,vegan,Made Okonomiyaki and Soondubu Jjigae w Soba,https://www.reddit.com/gallery/v2jqrl,False
Zealousideal-Clue-18,t2_7lursrwf,1654097812,v2jrzq,0,/r/vegan/comments/v2jrzq/your_favourite_vegan_options_in_las_vegas/,1,[removed],vegan,Your favourite vegan options in Las Vegas?,https://www.reddit.com/r/vegan/comments/v2jrzq/your_favourite_vegan_options_in_las_vegas/,True
glossolalia521,t2_p2myuuo,1654099721,v2khp6,1,/r/vegan/comments/v2khp6/my_quest_to_find_the_best_tasting_vegan_protein/,1,"Vegan lifters, let’s be honest: we’re chugging protein shakes for their anabolic effect, not because they taste great. Some of them do taste great, but I find them to be more the exception than the rule.

So I’ve tried just about every vegan protein on the market. And here is my subjective list of their flavor profiles, from MOST noticeable flavor (bad) to LEAST flavor (good):

**Pea protein**: I find it really hard to mask this stuff. Caramel/pumpkin spice sort of works, but you can usually tell when you’re drinking pea protein. That’s not a good thing.

**Soy protein**: Not as obnoxious tasting as pea protein, but it’s chalkiness leaves something to be desired. 

**Hemp protein**: This is where things turn a corner. You can definitely taste hemp protein, but it’s manageable. For an added level of neutrality, look for hemp heart protein. It’s powdery white and is much more neutral than pea or soy.

**Peanut protein**: OK, so you definitely taste this, but the taste is so pleasant that it deserves a spot near the top of the list. If you’re a fan of peanut, you can safely add as much of this stuff as you want and it’ll never taste icky at all. 

But recently, I’ve discovered my absolute favorite vegan protein powder…

*Pumpkin seed protein**: You can barely taste this stuff. Like at all. Most protein powders start to taste a bit obnoxious after adding 30g or so to your shake. Not this. I’m easily adding 15-20g of protein to my shakes without any noticeable change in flavor. Game changer.

What do you guys think? I’ve found that a key to improving my fitness goals is finding protein shakes I’m actually happy to drink, and finding neutral flavors has been essential to creating those recipes. 

It’s tough to reach the recommended 0.8-1.0g of protein per pound of body weight benchmark on a vegan diet. Hopefully this will help!",vegan,My quest to find the best tasting vegan protein powder,https://www.reddit.com/r/vegan/comments/v2khp6/my_quest_to_find_the_best_tasting_vegan_protein/,True
maleveganwithcats,t2_5riraglm,1654099993,v2klo4,1,/r/vegan/comments/v2klo4/tackling_the_fiction_that_eggs_are_healthy_in_any/,1,,vegan,Tackling the fiction that eggs are “healthy” in any way,https://youtu.be/RtGf2FuzKo4,False
Alternative-Bet232,t2_eev3efu5,1654100185,v2kog0,1,/r/vegan/comments/v2kog0/the_tale_of_the_banana_cookies_and_how_ive/,1,"Oh, r/vegan - have you ever been there - someone makes a vegan dish just for you, only it contains an ingredient you just don’t like, so you eat it anyway? 

Well, here’s my story.

Last fall, my bf and I went to a party for a religious holiday - not a major holiday but a nice reason to get together and celebrate. A mutual friend, H, was there. Neither bf nor myself are very close to H, but we both enjoy his company and he’s always been one to make sure everyone feels included. 

H brought some cookies to the party, which everyone raved about. He asked if I wanted to try, and I politely declined and explained that I was vegan. He apologized that I couldn’t enjoy, and said he’d make something vegan next time.

A month later, there is another party, and H came up to me a few minutes after my bf and I arrived to tell me he’d made two batches of cookies this time: one vegan, one “regular.” I thanked him and told him how much I appreciated it. He told me it was pretty easy to swap out the eggs - he just used mashed banana.

I panicked inside for a second - I haaaate bananas. Like, in any form. I just cannot choke down anything with bananas, even if there’s just a small portion. 

I smiled and said I was so excited to try one. And so a few minutes later, I did. And... look, if you liked bananas or even felt neutral about them, you would love these cookies. But I just could not get past the taste. 

That being said, I wanted to show H how much I appreciated that he made vegan cookies so I could try them, so I told him I loved the cookie.

A few months pass, and this weekend bf and I threw a party for MDW. We invited H, and when he arrived, he handed us a tupperware full of the cookies - since he remembered I loved them so much last time! He then proceeded to tell the group that it’s his grandma’s recipe and how happy he is to be able to share it with friends.

Well, I think I’m a little bit trapped now. I do not like bananas, I probably never will, but I also value my friendship with H and if that means eating a cookie I don’t like that he’s so proud to share every couple of months- that’s okay. I’ll eat the cookie. 

I’m sure I’m not the only one who has eaten a vegan dish with an ingredient they don’t like, because someone made it special just for them. I’d love to hear your stories.",vegan,"The tale of the banana cookies, and how I’ve trapped myself",https://www.reddit.com/r/vegan/comments/v2kog0/the_tale_of_the_banana_cookies_and_how_ive/,True
thecamelliamoon,t2_83djnptx,1654102077,v2leku,1,/r/vegan/comments/v2leku/ive_created_a_7day_plantbased_challenge_that_can/,1,[removed],vegan,I've created a 7-day Plant-Based Challenge that can also be used as a meal plan!,https://www.reddit.com/r/vegan/comments/v2leku/ive_created_a_7day_plantbased_challenge_that_can/,True
ratedvfood,t2_554iyvhx,1654102499,v2lked,1,/r/vegan/comments/v2lked/high_protein_dessert_bars_vegan_quinoa_crunch/,1,,vegan,High Protein Dessert Bars! Vegan Quinoa Crunch Bars that you Must Try!,https://youtube.com/watch?v=koYd560wERg&amp;feature=share,False
I_Love_Tea2,t2_ccxx21uy,1654102814,v2loxi,0,/r/vegan/comments/v2loxi/if_someone_offers_me_i_plant_based_chocolate_from/,1,[removed],vegan,if someone offers me I plant based chocolate from a box of chocolates that contains non vegan chocolate also?,https://www.reddit.com/r/vegan/comments/v2loxi/if_someone_offers_me_i_plant_based_chocolate_from/,True
Fox-The-Wise,t2_4t6kl2r4,1654102878,v2lpvz,0,/r/vegan/comments/v2lpvz/shamanism_and_veganism/,1,[removed],vegan,shamanism and veganism,https://www.reddit.com/r/vegan/comments/v2lpvz/shamanism_and_veganism/,True
Hardcorr_4448,t2_e4o6ga5g,1654102928,v2lqmd,1,/r/vegan/comments/v2lqmd/im_allergic_to_soy_what_now_any_tips/,1,"I am a vegetarian my whole life, Vegan and macrobiotic most of my life. Now being vegan again for around 3 years, I’m also beginning with exercise and need my protein. 

For 2.5 years I ate soy yoghurt from Alpro every morning, but I’m allergic. My face gets tingly and itchy from raw soy (So no soy milk) and processed soy (yoghurt, tofu, tempeh) causes stomach-aches and Im done with it. 

What is a easy breakfast, protein-rich for vegans (otherwise I need to go back to organic-dairy, but the thought of it makes me nauseous) 
Thank you",vegan,"I’m allergic to soy, what now? Any tips?",https://www.reddit.com/r/vegan/comments/v2lqmd/im_allergic_to_soy_what_now_any_tips/,True
ithink2020,t2_z5ik3,1654103143,v2ltmf,0,/r/vegan/comments/v2ltmf/looking_for_plantbasedvegan_recommendations/,1,[removed],vegan,Looking for Plant-Based/Vegan recommendations around Mall of America?,https://www.reddit.com/r/vegan/comments/v2ltmf/looking_for_plantbasedvegan_recommendations/,True
JodieFosterFreeze,t2_7qwk8gv5,1654104035,v2m68z,1,/r/vegan/comments/v2m68z/what_nonvegan_foods_do_you_think_could_be/,1,"I'll start.

*Most baked goods and sweets. Cookies, cakes, donuts, muffins, bagels, croissants etc. I think even some vegan ice creams could really fool most folks nowadays.    

*Protein powders. At least from a taste perspective, they taste exactly the same as non-vegan protein powders. 

*Some vegan chicken nuggets and vegan fried chicken. I've tasted a few brands now where I have to double check the ingredients because the texture is so similar to what I remember chicken being. 

*Vegan hot dogs. I think this is one of the first foods that vegans/vegetarians really nailed. 

*Vegan mayonnaise. I doubt many would notice this one. 

*Some vegan eggs. Especially the ones that are made into a patty. I honestly think most couldn't tell the difference.",vegan,What non-vegan foods do you think could be replaced with vegan versions and most people wouldn't notice?,https://www.reddit.com/r/vegan/comments/v2m68z/what_nonvegan_foods_do_you_think_could_be/,True
blessmyfoodbypayal,t2_85vzteoa,1654105217,v2mmrd,0,/r/vegan/comments/v2mmrd/mango_semolina_cake_nothing_can_be_more_simpler/,1,,vegan,MANGO SEMOLINA CAKE. Nothing can be more simpler than making this.,https://i.redd.it/3hk38d2jq1391.jpg,False
alpinepunch2021,t2_c2houkih,1654106174,v2n03x,0,/r/vegan/comments/v2n03x/my_boyfriends_going_vegan/,1,[removed],vegan,My boyfriend's going vegan,https://www.reddit.com/r/vegan/comments/v2n03x/my_boyfriends_going_vegan/,True
DarkOplar,t2_nqfystaw,1654107079,v2ndtn,0,/r/vegan/comments/v2ndtn/i_feel_vegans_need_a_way_of_saying_goodbye/,1,[removed],vegan,"I feel Vegans need a way of saying goodbye similar to ""may the force be with you"" or ""this is the way""",https://www.reddit.com/r/vegan/comments/v2ndtn/i_feel_vegans_need_a_way_of_saying_goodbye/,True
olimbsis,t2_9asxeedm,1654107730,v2nn7d,1,/r/vegan/comments/v2nn7d/even_leftists_dont_talk_about_animals/,1,,vegan,Even leftists don't talk about animals.,https://youtu.be/bYDQZ3Neeqo,False
RainbowKitchen,t2_v4t6fxt,1654108058,v2nrq7,1,/r/vegan/comments/v2nrq7/5ingredient_chickpea_hazelnut_energy_balls/,1,,vegan,5-Ingredient Chickpea Hazelnut Energy Balls,https://i.redd.it/wx2in9kty1391.jpg,False
Serious-Evening6072,t2_nymqh9rt,1654108089,v2ns5r,0,/r/vegan/comments/v2ns5r/relationship_with_a_nonvegan/,1,[removed],vegan,Relationship with a non-vegan?,https://www.reddit.com/r/vegan/comments/v2ns5r/relationship_with_a_nonvegan/,True
Soksies,t2_1r511aj9,1654109183,v2o7kc,0,/r/vegan/comments/v2o7kc/fresh_spring_rolls_with_peanut_butter_tofu_is_a/,1,,vegan,Fresh spring rolls with peanut butter tofu is a great meal on a hot day. 💚,https://www.reddit.com/gallery/v2o7kc,False
ScrubLordKyle18,t2_5fqb6tr1,1654109214,v2o7z2,0,/r/vegan/comments/v2o7z2/a_very_wholesome_post/,1,,vegan,A very wholesome post,https://v.redd.it/3e7zb9sd22391,False
Tetraplasm,t2_pnsyu,1654110011,v2oie6,1,/r/vegan/comments/v2oie6/any_servicestools_to_find_vegan_roommates/,1,"Hey all,  


I'm a recent (\~4 months) vegan in the Los Angeles, CA area, and I'm going to need to move soon. I'm looking to room with a vegan (ideally), for the obvious reasons (not wanting to see corpses in the fridge, smell corpses, receive annoying questions, etc.). Does anyone know of any tools or platforms to help find a vegan roommate? Obviously I'm also sort of inquiring in here if any fellow vegans here are looking for a roommate.  


Not sure if this is relevant/the right tag, first post here.",vegan,Any Services/Tools to Find Vegan Roommates?,https://www.reddit.com/r/vegan/comments/v2oie6/any_servicestools_to_find_vegan_roommates/,True
Senior-Extreme-7757,t2_lisn2bq5,1654110406,v2onwr,1,/r/vegan/comments/v2onwr/guys_i_found_a_new_website_its_nice/,1,,vegan,Guys I found a new website it’s nice,https://www.googleadservices.com/pagead/aclk?sa=L&amp;ai=DChcSEwiByb6p-Yz4AhUMPq0GHVhTAHIYABAAGgJwdg&amp;ae=2&amp;ohost=www.google.com&amp;cid=CAASJuRoPxQmWayxmJ2igLBZvBgUOdSfsLP9hBG4yD1uRE4BqSUGq3Yq&amp;sig=AOD64_3zyP_gEWH1ItRBrdOEArbzB0wqGQ&amp;q&amp;adurl&amp;ved=2ahUKEwjcqbWp-Yz4AhVbqY4IHRH5BB8Q0Qx6BAgFEAE,False
lusboy,t2_4jm9yf18,1654110850,v2oua8,1,/r/vegan/comments/v2oua8/i_live_in_a_country_where_the_public_torture_and/,1,"I live in Spain.
To me, it's incredibly disgusting that the king (yeah, something from the middle ages we haven't get rid of... Yet) is used to attend that public massacre, where bullfighters are called 'masters', where followers of this culture of death chant ""vivan los toros"" (""long life to the bulls"") and where a huge chunk of the attendants are devout Catholics (where is the fifth commandant?).

Oh, and there a small chapel in every bull ring where the bullfighter prays and asks the saints to protect him.

Luckily it's popularity dwindles every year, but everything that surrounds this ""national fest"" is incredibly hypocritical that I cannot stand with it. And I have to close my mouth, lest I'm called disrispectful.",vegan,I live in a country where the public torture and murder of an animal is labelled and culture and praised by authorities,https://www.reddit.com/r/vegan/comments/v2oua8/i_live_in_a_country_where_the_public_torture_and/,True
lusboy,t2_4jm9yf18,1654110960,v2ovsx,1,/r/vegan/comments/v2ovsx/i_live_in_a_country_where_the_public_torture_and/,1,"I live in Spain.
To me, it's incredibly disgusting that the king (yeah, something from the middle ages we haven't get rid of... Yet) is used to attend that public massacre, where bullfighters are called 'masters', where followers of this culture of death chant ""vivan los toros"" (""long life to the bulls"") and where a huge chunk of the attendants are devout Catholics (where is the fifth commandant?).

Oh, and there a small chapel in every bull ring where the bullfighter prays and asks the saints to protect him.

Luckily it's popularity dwindles every year, but everything that surrounds this ""national fest"" is incredibly hypocritical that I cannot stand with it. And I have to close my mouth, lest I'm called disrispectful.",vegan,I live in a country where the public torture and murder of an animal is labelled as culture and praised by authorities,https://www.reddit.com/r/vegan/comments/v2ovsx/i_live_in_a_country_where_the_public_torture_and/,True
baethehippy,t2_2o2cyaap,1651363902,ufnn38,1,/r/vegan/comments/ufnn38/smallaffordable_us_cities_for_vegans/,1,"Anyone here live in a small city or suburb in the states that has lots of vegan options/people and is actually affordable? I’ve looked at lots of “best vegan cities” lists but housing in the big cities I’ve seen on them is crazy expensive. I have always lived in WI (stayed here bc it’s cheap and family is here) and absolutely hate it—the cold winters, the people who only care about getting drunk or hunting, the subtle racism, everything. My fiancé is moving here from Mexico and we want to live somewhere that has more vegans and diversity where we feel we’ll actually fit in. 🙂",vegan,Small/affordable US cities for vegans?,https://www.reddit.com/r/vegan/comments/ufnn38/smallaffordable_us_cities_for_vegans/,True
bartharris,t2_10tkkn,1651364554,ufnuhs,1,/r/vegan/comments/ufnuhs/i_wrote_just_a_very_short_piece_on_the_loneliness/,1,,vegan,I wrote just a very short piece on the loneliness of my five year veg anniversary,https://bartharris.medium.com/bittersweet-veganniversary-949ba0a415f5,False
Just_Classic5984,t2_b0q6c6hv,1651364917,ufnyel,1,/r/vegan/comments/ufnyel/vegan_research/,1,[removed],vegan,Vegan research,https://www.reddit.com/r/vegan/comments/ufnyel/vegan_research/,True
confused-seagull,t2_7bluzs3o,1651365285,ufo2cp,0,/r/vegan/comments/ufo2cp/while_i_realize_i_might_be_a_weirdo_for_it_i_like/,1,,vegan,"While I realize I might be a weirdo for it, I like to have coffee creamer in my bag all the time. Because I've lost track of how many cups of black coffee I've had with french fries at restaurants over the years. If anyone else would like the info you can get a box of 50 for $6 shipped from Big lots",https://i.redd.it/tsy7ny6bfrw81.jpg,False
Unusual-Shoulder-268,t2_matjbfq3,1651366368,ufodzd,1,/r/vegan/comments/ufodzd/rpublicfreakout_post_exposing_inhumane_factory/,1,"I'm just venting I guess, checked the rules and I don't think this is against them.

It was a recent post of people who got into a factory farm and filmed the conditions inside until the torturer who managed it physically assaulted the people, and *so* much of the discourse was framed as ""Wow, look at the uniquely inhuman conditions of this particular factory farm."" 

There's a reason meat lobbyists paid as much as they did to pass ag-gag laws; *they are all that way*. And even if they weren't, you would never call murder that wasn't preceded by extensive torture moral. 

Just fucking sucked to re-live some of those videos of baby pigs squealing and suffering, even if it was only for a few seconds, and kind of fucked up my night. 

I guess this is just an appreciation post for all of you who have committed to not being a part of that insane cruelty.",vegan,"R/PublicFreakout post exposing ""inhumane"" factory farm conditions",https://www.reddit.com/r/vegan/comments/ufodzd/rpublicfreakout_post_exposing_inhumane_factory/,True
No-Advantage-6449,t2_mbgxylb4,1651366605,ufogex,1,/r/vegan/comments/ufogex/want_to_go_vegan_suggestions/,1,"So, I wanna go vegan: But I’m afraid I won’t plan my diet adequately and suffer from deficiencies. Any tips? Good sources of protein? Dishes and recipes? Also, I’ve heard that vitamin b-12 is the sole vitamin you cannot Syrian from a vegan diet, but that it’s stored and lasts 10 years if you’re a new vegan. Is that true? Regardless, how do you make sure good don’t suffer from a b-12 deficiency? Is it a vital nutrient anyway?",vegan,Want to go vegan. Suggestions?,https://www.reddit.com/r/vegan/comments/ufogex/want_to_go_vegan_suggestions/,True
Inevitable_Lawyer_19,t2_6fqi0d7x,1651367621,ufor1v,0,/r/vegan/comments/ufor1v/i_made_a_just_egg_quiche_with_spinach_and/,1,,vegan,I made a Just Egg Quiche with spinach and asparagus,https://www.reddit.com/gallery/ufor1v,False
HappyJacks43,t2_95pgw,1651368349,ufoyo7,0,/r/vegan/comments/ufoyo7/what_will_dogs_eat_in_4050_years/,1,[removed],vegan,What will dogs eat in 40-50 years?,https://www.reddit.com/r/vegan/comments/ufoyo7/what_will_dogs_eat_in_4050_years/,True
sancoca,t2_2vyu32bb,1651368695,ufp29n,0,/r/vegan/comments/ufp29n/vegan_english_breakfast_anyone/,1,,vegan,Vegan English Breakfast anyone?,https://i.redd.it/jwcdlvqfprw81.jpg,False
SotoFTW_YT,t2_5uskz9bn,1651370759,ufpnwy,1,/r/vegan/comments/ufpnwy/vegan_food_is_actually_really_good/,1,"I’m personally not a Vegan myself but i don’t have anything against Vegans. I’ve been recently trying some Vegan food and it’s amazing, Vegan Chicken Nuggets are incredible i tried Vegan Spaghetti Bolognaise the other day and that was also really good. Personally i can’t go fully Vegan but i’ll be damned Vegans have invented some of the best dishes i have tried.",vegan,Vegan food is actually really good.,https://www.reddit.com/r/vegan/comments/ufpnwy/vegan_food_is_actually_really_good/,True
valdah55,t2_6aiir5zh,1651372905,ufq9qr,1,/r/vegan/comments/ufq9qr/would_you_read_a_coming_of_age_book_set_at_a/,1,"I am writing a book that's basically the story of a teen girl who goes through an internal change and goes from being a carnist to a vegan due to her experiences at said sanctuary. Of course there is other conflict like heartbreak, losing a parent, grieving for lost loved ones, both human and non-human and society at large being unable to grasp the profound change that comes with being an ethical vegan. 

So would you read this book, if you're already vegan?",vegan,Would you read a coming of age book set at a farmed animal sanctuary?,https://www.reddit.com/r/vegan/comments/ufq9qr/would_you_read_a_coming_of_age_book_set_at_a/,True
ellogovernorYES,t2_71dul,1651373310,ufqdoj,1,/r/vegan/comments/ufqdoj/my_very_good_friend_is_getting_married/,1,"We are in the midst of planning the Bachelorette party. It is assumed the bridal party will split the cost of everything for the bride that day, including omni meals and non v spa treatments. I feel so uncomfortable and gross with financially contributing to animal abuse. I've always been firm on not engaging with any sort of non v activity but this feels like a real curveball. Anyone have insight on navigating this? Thanks pals. 


Ps I can already see the mocking ""my friend is having a dog kicking party and wants me to pay for it. Insight?"" post on r/vegancirclejerk. Love u filthy soybeans. Xo",vegan,my very good friend is getting married,https://www.reddit.com/r/vegan/comments/ufqdoj/my_very_good_friend_is_getting_married/,True
Patyrc,t2_63h7pd7q,1651373560,ufqg33,0,/r/vegan/comments/ufqg33/is_it_possible_to_be_vegan_without_eating_beans/,1,[removed],vegan,Is it possible to be vegan without eating beans?,https://www.reddit.com/r/vegan/comments/ufqg33/is_it_possible_to_be_vegan_without_eating_beans/,True
licegirl,t2_5clqkak3,1651374294,ufqngg,0,/r/vegan/comments/ufqngg/waiting_for_the_farting_phase_to_be_over/,1,[removed],vegan,Waiting for the farting phase to be over,https://www.reddit.com/r/vegan/comments/ufqngg/waiting_for_the_farting_phase_to_be_over/,True
Fantastic_Ad7023,t2_5jc5tjgy,1651375316,ufqwzu,0,/r/vegan/comments/ufqwzu/i_am_actually_a_dietitian_and_even_people_who/,1,,vegan,I am actually a dietitian and even people who know this be lecturing me on nutrition. 🙄,https://i.redd.it/08d1o0x49sw81.jpg,False
These-Ad-1260,t2_d3nzdnc2,1651375796,ufr1i8,0,/r/vegan/comments/ufr1i8/whats_the_difference_between_fortified_and_non/,1,,vegan,What’s the difference between fortified and non fortified yeast flakes? Is the taste any different? 🤔🙂,https://www.reddit.com/gallery/ufr1i8,False
