author,author_fullname,created_utc,id,num_comments,permalink,score,selftext,subreddit,title,url,is_self
Suspicious_Plant4231,t2_38w2p5hj,1654206928,v3jzab,0,/r/PlantBasedDiet/comments/v3jzab/your_favorite_granola_recipe/,1,"I didn't think I'd have this much trouble finding a good recipe. A few years ago I was eating the Naked Bear vanilla almond granola and I liked it a lot, but the sugar is less than ideal, so I want to try and make my own.",PlantBasedDiet,Your favorite granola recipe?,https://www.reddit.com/r/PlantBasedDiet/comments/v3jzab/your_favorite_granola_recipe/,True
ginto202,t2_79ila6,1654208568,v3kki7,0,/r/PlantBasedDiet/comments/v3kki7/easy_6ingredient_avocado_icecream_recipe_with/,1,,PlantBasedDiet,Easy 6-Ingredient Avocado Ice-Cream Recipe With Coconut Milk And NO dairy. Eat Without Guilt!,https://juicing-for-health.com/6-ingredient-ice-cream-recipe-with-avocado-coconut-milk,False
competent_enough,t2_o11ralho,1654215076,v3mq4y,0,/r/PlantBasedDiet/comments/v3mq4y/how_do_you_spell_plantbased/,1,"[removed]

[View Poll](https://www.reddit.com/poll/v3mq4y)",PlantBasedDiet,HOW DO YOU SPELL PLANT-BASED??,https://www.reddit.com/r/PlantBasedDiet/comments/v3mq4y/how_do_you_spell_plantbased/,True
waxwolf15,t2_jhjvwur,1654222451,v3p04e,0,/r/PlantBasedDiet/comments/v3p04e/oh_my_god_after_36_years_ive_finally_become_a/,1,[removed],PlantBasedDiet,"Oh my god, after 36 years I've finally become a salad person. Send help (and recipes pls).",https://www.reddit.com/r/PlantBasedDiet/comments/v3p04e/oh_my_god_after_36_years_ive_finally_become_a/,True
J_vegan777,t2_elt3xkba,1654229963,v3r5v9,0,/r/PlantBasedDiet/comments/v3r5v9/nutritional_question_for_exercise/,1,[removed],PlantBasedDiet,Nutritional Question for Exercise,https://www.reddit.com/r/PlantBasedDiet/comments/v3r5v9/nutritional_question_for_exercise/,True
Yae_Bae,t2_jl16p91k,1654243363,v3ug6q,0,/r/PlantBasedDiet/comments/v3ug6q/broccoli_recipies/,1,"I am slowly adding more and more fruits and wegetables to my diet - Before, I used to think that almost all wegetables are disgusting - and I feel like serving myself some nice broccoli meal or at least recipe that contains it. Do you have any that would be easy to make?

I am living in small country so I don't have access to more ""luxurious"" plant based ingrediets so it's for the best to stick to regulars like weggies you can find in the store, pastas, soy milk or whatever.",PlantBasedDiet,Broccoli recipies?,https://www.reddit.com/r/PlantBasedDiet/comments/v3ug6q/broccoli_recipies/,True
RecommendationKey877,t2_92myuhnb,1654247880,v3vfo3,0,/r/PlantBasedDiet/comments/v3vfo3/kidney_bean_and_quinoa_topped_with_some_coriander/,1,,PlantBasedDiet,Kidney bean and quinoa topped with some coriander and sprinkled a little apple cider vinegar!! 💟,https://i.redd.it/zg0guhfqid391.jpg,False
Hotpooriz_Vegan_gf,t2_jmrryfy4,1654250458,v3vzyg,0,/r/PlantBasedDiet/comments/v3vzyg/vegan_gluten_free_nutfree_curry_meal_recipe/,1,,PlantBasedDiet,Vegan Gluten free nutfree Curry meal Recipe,https://youtu.be/EzhFnrkg74U,False
YourHealth_Guide,t2_nyar9czt,1654256574,v3xio7,0,/r/PlantBasedDiet/comments/v3xio7/do_you_know_which_alcohol_is_the_worst_on_keto_in/,1,[removed],PlantBasedDiet,Do You Know Which Alcohol is the Worst on Keto In 2022?,https://www.reddit.com/r/PlantBasedDiet/comments/v3xio7/do_you_know_which_alcohol_is_the_worst_on_keto_in/,True
MarryBen2000,t2_8fp5bspk,1654260833,v3yrl4,0,/r/PlantBasedDiet/comments/v3yrl4/vegetarians_can_also_get_colon_cancer_6_tips_to/,1,,PlantBasedDiet,Vegetarians Can Also Get Colon Cancer? 6 Tips To Keep Your Vegetarian Diet Healthy,https://collective-spark.xyz/vegetarians-can-also-get-colon-cancer-6-tips-to-keep-your-vegetarian-diet-healthy/,False
Suspicious_Plant4231,t2_38w2p5hj,1654263996,v3zrye,0,/r/PlantBasedDiet/comments/v3zrye/how_do_you_explain_to_people_that_you_dont_really/,1,"My family is a pretty ""I like you, let's eat a meal out together"" group of people, and so is the rest of our society I guess. I'm very difficult to eat out with for two reasons, the first being I eat WFPB (obviously), and the second being that I have a chronic condition, and how I eat can affect how I feel more than other people. I also just care about my general health and have athletic goals that the rest of my family doesn't have. I'm content with making my own meals and eating them at home, but it's hard to explain that to other people without being a buzzkill or sounding extreme. 

Today I already don't feel well, and some of my family from out of town want to eat lunch. I want to visit with them, but I'm not in the mood to feel worse than I already do. I don't talk about how I feel in regards to my condition because no one really understands it, and because it's pretty much invisible it just seems like an excuse.",PlantBasedDiet,How do you explain to people that you don't really eat out?,https://www.reddit.com/r/PlantBasedDiet/comments/v3zrye/how_do_you_explain_to_people_that_you_dont_really/,True
ginto202,t2_79ila6,1654269105,v41j61,0,/r/PlantBasedDiet/comments/v41j61/juicing_on_a_budget_practical_tips_to_ensure_that/,1,,PlantBasedDiet,Juicing On A Budget - Practical Tips To Ensure That You Keep Juicing,https://juicing-for-health.com/tips-on-how-to-keep-on-juicing-on-a-budget,False
dabirds1994,t2_16uij4,1654269533,v41olp,0,/r/PlantBasedDiet/comments/v41olp/plant_milk_is_coming_for_your_kids/,1,,PlantBasedDiet,Plant Milk Is Coming for Your Kids,https://www.bloomberg.com/news/features/2022-06-03/plant-milk-markets-to-kids-as-big-dairy-pushes-back?sref=14Z55afH,False
EcoWorlder,t2_nwazpfoq,1654273574,v4350k,0,/r/PlantBasedDiet/comments/v4350k/oh_so_youre_plantbased_what_do_you_even_eat/,1,,PlantBasedDiet,“Oh so you’re plant-based? What do you even eat?!”,https://i.redd.it/t8mimr3jwe391.jpg,False
lordlywaluigi,t2_1g2ei56u,1654295574,v4ato0,0,/r/PlantBasedDiet/comments/v4ato0/birthday_celebration_ideas/,1,[removed],PlantBasedDiet,Birthday Celebration Ideas?,https://www.reddit.com/r/PlantBasedDiet/comments/v4ato0/birthday_celebration_ideas/,True
ChloeMomo,t2_y3ped,1654298961,v4bxeb,0,/r/PlantBasedDiet/comments/v4bxeb/researchers_find_that_eating_a_certain_protein/,1,,PlantBasedDiet,Researchers Find That Eating a Certain Protein [found in animal products] Is Related to Developing Depression,https://scitechdaily.com/researchers-find-that-eating-a-certain-protein-is-related-to-developing-depression/,False
OdisNix,t2_8ambgske,1654306829,v4eajf,0,/r/PlantBasedDiet/comments/v4eajf/heres_what_your_doctor_the_food_industry_and_even/,1,,PlantBasedDiet,"Here's what your Doctor, the Food Industry and even our Government won't tell you about the foods we're told to eat, Dr. John McDougall is a world famous doctor who shares all the lies about Omega-3 Fish Oil and other multi-billion dollar industries telling us what we need to stay healthy.",https://youtube.com/watch?v=zk2xKKbjHTo&amp;feature=share,False
Little-Mottie,t2_3al97k5x,1654309999,v4f7ab,0,/r/PlantBasedDiet/comments/v4f7ab/want_to_be_plant_based_but_struggle_with_textures/,1,"I have a couple sensory issues I struggle with, and a major one is food texture. I want to love things like quinoa and chickpeas, but the moment they’re in my mouth, my gag reflex is immediately set off. The same goes for most other beans. I hate how squishy they feel, I don’t know a better way to describe it. 

Are there any tips to getting over these sensitivities asides from suffer through until you get over it? Or any good alternatives?

Thanks",PlantBasedDiet,"Want to be plant based, but struggle with textures",https://www.reddit.com/r/PlantBasedDiet/comments/v4f7ab/want_to_be_plant_based_but_struggle_with_textures/,True
normificator,t2_1bd9ewb0,1654314100,v4gc61,0,/r/PlantBasedDiet/comments/v4gc61/do_any_of_you_wear_a_continuous_glucose_monitor/,1,"I’m realising that my average blood glucose is on the higher side even though I’m on a whole food plant based diet. 

Foods like blue berries, sweet potatoes and whole grains which I originally thought were very healthy actually cause very high glucose spikes for me. 

I’m an active mid 30s male who exercises regularly with an athletic physique. 

Anyone with similar experiences?",PlantBasedDiet,Do any of you wear a continuous glucose monitor?,https://www.reddit.com/r/PlantBasedDiet/comments/v4gc61/do_any_of_you_wear_a_continuous_glucose_monitor/,True
VeganSweetAddiction,t2_l8a2r3l1,1654326285,v4jf8f,0,/r/PlantBasedDiet/comments/v4jf8f/what_would_you_say_if_i_told_you_this_tiramisu/,1,,PlantBasedDiet,"What would you say if I told you this tiramisu was vegan 🌱😻 But trust me it taste authentic AF (I’ve heard that my second photo looks like a bamboo toothbrush 😱😂, what do you think ?)",https://www.reddit.com/gallery/v4jf8f,False
reddot409,t2_i4et07a5,1654343336,v4n8gs,0,/r/PlantBasedDiet/comments/v4n8gs/i_had_a_nice_snack_today_at_work_cleaning_those/,1,,PlantBasedDiet,I had a nice snack today at work cleaning those strawberies,https://i.redd.it/tkmnk4gkel391.jpg,False
Immediate_Scholar_77,t2_8t1xa0p6,1654346854,v4o6a8,0,/r/PlantBasedDiet/comments/v4o6a8/spinach_and_potato_curry/,1,,PlantBasedDiet,spinach and potato curry,https://i.redd.it/zf72vrh1pl391.jpg,False
tits-n-teeth,t2_7c5n13k1,1654348043,v4oiuf,0,/r/PlantBasedDiet/comments/v4oiuf/help_non_starchy_meals/,1,I have been told I need to follow a non-starchy diet. I'm so stuck! Literally everything I eat seems to be starchy :( can anyone suggest anything?,PlantBasedDiet,Help!! Non starchy meals?,https://www.reddit.com/r/PlantBasedDiet/comments/v4oiuf/help_non_starchy_meals/,True
kokoxoxoo,t2_aazpy2n,1654350569,v4p9tv,0,/r/PlantBasedDiet/comments/v4p9tv/i_love_fruit_so_much_it_makes_me_cry/,1,[removed],PlantBasedDiet,I love fruit so much it makes me cry.,https://www.reddit.com/r/PlantBasedDiet/comments/v4p9tv/i_love_fruit_so_much_it_makes_me_cry/,True
PurpleBrevity,t2_2k9r6xzd,1654358318,v4rszx,0,/r/PlantBasedDiet/comments/v4rszx/soy_curls_keep_seeing_these_in_all_my_veggie/,1,,PlantBasedDiet,Soy Curls - keep seeing these in all my veggie groups so I bought some. Looking for all your favorite ways to use these. Hit me with your recipes.,https://i.redd.it/45wovzn4nm391.jpg,False
navyblue4222,t2_223jnh98,1654362296,v4t5ud,0,/r/PlantBasedDiet/comments/v4t5ud/incidence_of_cancer/,1,"Hey folks! I’m trying to discuss the carcinogenic properties of meat / eggs / dairy with one of my friends. A piece of knowledge I found extremely compelling when I transitioned to vegan/plant based was the decreased incidence in cancer in among less affluent Asian populations (compared to the more affluent folk that ate a more western diet). 

However, when I try to explain this to him, his response is that a shorter life expectancy is the reason for the gap in cancer diagnoses (IE, people can’t develop cancer if they don’t live long enough). Has anyone else been presented this argument before and/or have a response?

His dad is in remission from esophageal cancer and he’s freaking out that he’s going to get it too someday, but doesn’t believe that adopting a plant based diet would decrease his risk of developing esophageal cancer.",PlantBasedDiet,Incidence of cancer,https://www.reddit.com/r/PlantBasedDiet/comments/v4t5ud/incidence_of_cancer/,True
dejael,t2_4ymz7hmx,1654369047,v4vere,0,/r/PlantBasedDiet/comments/v4vere/i_never_thought_id_enjoy_oatmeal_with_no_added/,1,Well I guess I can if I’m issuing the right unsweetened almond milk brand  🤷🏾‍♀️,PlantBasedDiet,I never thought I’d enjoy oatmeal with no added sugar,https://www.reddit.com/r/PlantBasedDiet/comments/v4vere/i_never_thought_id_enjoy_oatmeal_with_no_added/,True
cesiiavz,t2_bi5ugzqd,1654373690,v4x3lk,0,/r/PlantBasedDiet/comments/v4x3lk/symptoms/,1,[removed],PlantBasedDiet,Symptoms,https://www.reddit.com/r/PlantBasedDiet/comments/v4x3lk/symptoms/,True
ShittyShittyNameName,t2_f9uo7,1654381025,v4zgxb,0,/r/PlantBasedDiet/comments/v4zgxb/what_chopped_up_ingredients_can_i_freeze_for_a/,1,"I am more likely to eat regular, plant-based meals when I can prep them ahead of time. Specifically, if I can freeze them and let them thaw for lunch time.

A lot of my heartier dishes freeze well because after they thaw, they taste more or less the same. Things like beans &amp; rice, potatoes, stews, and soups.

But salads and bowls take the most prep time because I have to prep each bowl. I add quinoa and chickpeas to my bowls, and those freeze well.

What I would like to do is freeze little containers with all my bowl ingredients (sans the leafy greens and cabbage) and just toss them into my bowl at lunchtime after they’ve thawed.

Diced apples seem to be good, and I think chopped up bell peppers do, too.

I’ve noticed strawberries, blueberries, and bananas don’t thaw well, so I just use those in smoothies (bananas were never used for bowls, I was just mentioning them cause).

Diced onions work, too! Almost forgot those.

Anything else work well for freezing for bowls? Do chopped grapes work? Diced cucumbers? What about sprouts? Firm tofu that’s been cubed but not cooked? Or cooked, I don’t know.

Thoughts? Suggestions?",PlantBasedDiet,What chopped up ingredients can I freeze for a bowl or salad? Which chopped up ingredients can I not freeze?,https://www.reddit.com/r/PlantBasedDiet/comments/v4zgxb/what_chopped_up_ingredients_can_i_freeze_for_a/,True
lkitup,t2_4af52vsh,1654386775,v519fs,0,/r/PlantBasedDiet/comments/v519fs/what_can_i_expect_for_weight_loss_f50/,1,[removed],PlantBasedDiet,What can I expect for weight loss? F50,https://www.reddit.com/r/PlantBasedDiet/comments/v519fs/what_can_i_expect_for_weight_loss_f50/,True
Knitspin,t2_62fveysb,1654388247,v51okp,0,/r/PlantBasedDiet/comments/v51okp/im_not_sure_if_this_is_the_right_sub_but_i_have/,1,,PlantBasedDiet,"I’m not sure if this is the right sub, but I have to share. My yogurt strainer fits on my instant pot, so I can pour my ground soybeans right in! I just started making Soymilk",https://i.redd.it/c71p1m944p391.jpg,False
jomtientofu,t2_j4d2n9aq,1654411697,v57rtx,0,/r/PlantBasedDiet/comments/v57rtx/one_of_my_favourite_fruits_of_all_time/,1,,PlantBasedDiet,one of my favourite fruits of all time.,https://i.redd.it/3hq1hbpu1r391.jpg,False
GraphCat,t2_c284z,1654444066,v5g3jh,0,/r/PlantBasedDiet/comments/v5g3jh/in_just_one_meal_ive_pretty_much_reached/,1,,PlantBasedDiet,"In just one meal, I've pretty much reached Cronometer's fiber goal for the day! I love WFPB!",https://i.redd.it/8neu6aavpt391.jpg,False
GraphCat,t2_c284z,1654444608,v5ga2i,0,/r/PlantBasedDiet/comments/v5ga2i/i_love_hitting_my_fiber_goal_in_only_one_meal/,1,,PlantBasedDiet,"I love hitting my ""fiber goal"" in only one meal!",https://i.redd.it/ylp6aqkprt391.jpg,False
cbensco,t2_5j24hhym,1654481155,v5s8zl,0,/r/PlantBasedDiet/comments/v5s8zl/favorite_summer_soups/,1,Send me your faves!,PlantBasedDiet,favorite summer soups?,https://www.reddit.com/r/PlantBasedDiet/comments/v5s8zl/favorite_summer_soups/,True
PotemkinCityLimits,t2_flyhn,1654498464,v5wsj1,0,/r/PlantBasedDiet/comments/v5wsj1/vegan_charities_to_receive_14_million_in_free/,1,,PlantBasedDiet,Vegan Charities To Receive $1.4 Million In Free Advertising,https://vegancreativecompass.com/blog/vegan-charities-to-receive-14-million-in-free-advertising,False
Jojoappsss,t2_mhqynaxp,1654499912,v5x4my,0,/r/PlantBasedDiet/comments/v5x4my/shared_shopping_list_app/,1,"Hi all, 
I made this app that might help some of you. It's a shopping list app but what's special about it is that you can share your shopping list with your family for free. This means that if you are doing your groceries and someone else update the list you will automatically see what this person added to the list. 
Please leave a review if you like it. 

Android: https://play.google.com/store/apps/details?id=com.yinqs.sharedfamilyshoppinglist
iOS: https://apps.apple.com/app/1626728216",PlantBasedDiet,Shared Shopping List App,https://www.reddit.com/r/PlantBasedDiet/comments/v5x4my/shared_shopping_list_app/,True
MarryBen2000,t2_8fp5bspk,1654506521,v5ym7c,0,/r/PlantBasedDiet/comments/v5ym7c/7_teas_linked_to_better_brain_health/,1,,PlantBasedDiet,7 Teas Linked To Better Brain Health,https://collective-spark.xyz/7-teas-linked-to-better-brain-health/,False
paulr85mi,t2_xqp53,1654523362,v63ysu,0,/r/PlantBasedDiet/comments/v63ysu/david_sinclair_harvard_genetist_time_restricted/,1,,PlantBasedDiet,"David Sinclair (Harvard genetist): time restricted eating and plant based improve life span, meat might be good in the short term but detrimental in the long one",https://youtu.be/mmRzeD4_41M,False
grl-pwr,t2_ngc3lou,1654542758,v6b4xb,0,/r/PlantBasedDiet/comments/v6b4xb/finally_tried_this_after_so_many_friends/,1,,PlantBasedDiet,Finally tried this after so many friends recommended. Tastes 10x better than any other vegan protein I’ve tried. Made from almonds and chickpeas. Highly recommend!!,https://i.redd.it/kas5r2fkv1491.jpg,False
mightfloat,t2_9dchwjn5,1654545424,v6c4a6,0,/r/PlantBasedDiet/comments/v6c4a6/less_peanut_butter_in_jars/,1,"Has anyone else noticed that a lot of natural peanut butter has noticeably more oil on top than before or am I just crazy? I don’t know if the actual peanut butter is just more compressed and making it appear to have more oil, or if they’re skimping because of recent price increases and using more oil. 

I buy at least 2 a week and I remember a time where I could barely mix it without spilling it because it was so full. Now it doesn’t even come close.",PlantBasedDiet,Less peanut butter in jars?,https://www.reddit.com/r/PlantBasedDiet/comments/v6c4a6/less_peanut_butter_in_jars/,True
lkitup,t2_4af52vsh,1654549117,v6dhsv,0,/r/PlantBasedDiet/comments/v6dhsv/should_i_be_expecting_weight_loss/,1,[removed],PlantBasedDiet,Should I be expecting weight loss?,https://www.reddit.com/r/PlantBasedDiet/comments/v6dhsv/should_i_be_expecting_weight_loss/,True
hey_man_yo,t2_6ikajza4,1654553022,v6eyg0,0,/r/PlantBasedDiet/comments/v6eyg0/ashtanga_yoga_forum/,1,[removed],PlantBasedDiet,Ashtanga yoga forum,https://www.reddit.com/r/PlantBasedDiet/comments/v6eyg0/ashtanga_yoga_forum/,True
Raj_9898,t2_aahodm3w,1654578738,v6n6tz,0,/r/PlantBasedDiet/comments/v6n6tz/things_you_must_know_before_going_on_a_plantbased/,1,,PlantBasedDiet,Things You Must Know Before Going On A Plant-Based Diet,https://goodguilt.com/good-guides/things-to-know-before-switching-to-a-plant-based-diet/,False
Colon-elcolon,t2_7e5ctuct,1654581045,v6nt1t,0,/r/PlantBasedDiet/comments/v6nt1t/simple_quick_breakfast_from_italy/,1,,PlantBasedDiet,Simple quick breakfast from Italy,https://i.redd.it/kei51ete15491.jpg,False
pipermaru84,t2_l6m2a,1654605295,v6uce3,0,/r/PlantBasedDiet/comments/v6uce3/anyone_do_high_carb_a_la_mcdougall_et_al_while/,1,"I’ve been on and off WFPB for a couple years, more in the “off” trend right now but still trying to incorporate a lot of whole foods (always vegan either way). I’ve recently started lifting weights while also trying to lose weight and I do notice some fatigue during my workouts that I think might be due to not having enough glycogen, so I’ve been looking into higher carb ways of eating. Per the WHO, you only need 0.8mg of protein per kg, which is a lot less than I’ve been shooting for, but does anyone lift heavy while at that number and find it successful? Any other tweaks you use to make it work, or just pure high carb? 

For reference if it matters, I’m 28f 5’6” 166lb shooting for 130lb right now, I had been trying to get around 80-90g of protein at 1350-1500cal but it seems like that might be overkill.",PlantBasedDiet,Anyone do high carb a la McDougall et al while weightlifting? How much protein do you shoot for in terms of mg/kg?,https://www.reddit.com/r/PlantBasedDiet/comments/v6uce3/anyone_do_high_carb_a_la_mcdougall_et_al_while/,True
yoyocola,t2_o2shj0wr,1654621657,v71lkg,0,/r/PlantBasedDiet/comments/v71lkg/the_dairy_industry_lobbied_the_fda_to_ban_the/,1,,PlantBasedDiet,"The dairy industry lobbied the FDA to ban the word “milk” on labels of almond milk, oat milk, soy milk, etc. This will burden these non-dairy companies with new costs and confuse their consumers. It was blatantly done to shut down competition.",https://reason.com/2022/06/06/do-we-really-need-the-federal-government-to-tell-us-what-milk-is/,False
GalaxyMoonStorm,t2_4op2jjd7,1654622693,v722gv,0,/r/PlantBasedDiet/comments/v722gv/wfpb_potato_salad_amazing/,1,,PlantBasedDiet,WFPB Potato Salad - Amazing!,https://i.redd.it/pm37ykw7h8491.jpg,False
UnitedJelly,t2_2fh043k2,1654631021,v75of3,0,/r/PlantBasedDiet/comments/v75of3/what_happens_when_there_is_chronic_inflammation/,1,,PlantBasedDiet,What happens when there is chronic inflammation? Inflammation is a naturally occurring immune response in the body. Your body responds to the presence of injury or foreign invaders such as a virus or bacteria by sending chemicals and white blood cells to fight them off helping your body heal.,http://clickmetertracking.com/da9s,False
hunchoblack,t2_hc8a8iw,1654632393,v766tw,0,/r/PlantBasedDiet/comments/v766tw/any_recipesrecommendations_for_meals_that_are/,1,[removed],PlantBasedDiet,Any recipes/recommendations for meals that are high protein &amp; soy free?,https://www.reddit.com/r/PlantBasedDiet/comments/v766tw/any_recipesrecommendations_for_meals_that_are/,True
EuphoricDiver1,t2_5ne3604u,1654732975,v83nxy,0,/r/PlantBasedDiet/comments/v83nxy/fiber_friendly_foods_for_nonvegans/,1,[removed],PlantBasedDiet,Fiber Friendly Foods for Non-Vegans,https://www.reddit.com/r/PlantBasedDiet/comments/v83nxy/fiber_friendly_foods_for_nonvegans/,True
c23-950,t2_14dozi,1654735866,v84lq5,0,/r/PlantBasedDiet/comments/v84lq5/how_to_use_dry_chickpeas/,1,"Bit confused about how to use dry chickpeas. If I soak them overnight, rinse them, can I just make a curry or stew out of the soaked chickpeas?

Or do you need to cook them first… then cook them again for a curry? 

Stupid question I know but Any help would be appreciated",PlantBasedDiet,How to use dry chickpeas,https://www.reddit.com/r/PlantBasedDiet/comments/v84lq5/how_to_use_dry_chickpeas/,True
Specialist-One2772,t2_bqmv9d7b,1654763737,v8c7hk,0,/r/PlantBasedDiet/comments/v8c7hk/has_anyone_done_both_starch_solution_and_fuhrman/,1,"I want to do Fuhrman but beans and nuts are migraine triggers for me, and many of the other things you have to eat on his diet aggravate my bladder.  But I find the starch solution unsatisfying and don't really like the food much.",PlantBasedDiet,Has anyone done both Starch Solution and Fuhrman? Which did you find better?,https://www.reddit.com/r/PlantBasedDiet/comments/v8c7hk/has_anyone_done_both_starch_solution_and_fuhrman/,True
MyEnglishisbad666,t2_n6dlvb8e,1654779451,v8ga01,0,/r/PlantBasedDiet/comments/v8ga01/i_need_iodine_supplement/,1,[removed],PlantBasedDiet,I need iodine supplement?,https://www.reddit.com/r/PlantBasedDiet/comments/v8ga01/i_need_iodine_supplement/,True
runawaydna2607,t2_dshpn3ve,1654781017,v8gs04,0,/r/PlantBasedDiet/comments/v8gs04/morning_glow_juice/,1,,PlantBasedDiet,Morning Glow Juice,https://i.redd.it/mdfcjn51kl491.jpg,False
Lowfat-Beast-2528,t2_nz76jqmf,1654782449,v8h8gz,0,/r/PlantBasedDiet/comments/v8h8gz/low_fat_insomnia/,1,[removed],PlantBasedDiet,Low fat insomnia,https://www.reddit.com/r/PlantBasedDiet/comments/v8h8gz/low_fat_insomnia/,True
hopeigotit,t2_9fz1po9p,1654784655,v8hz40,0,/r/PlantBasedDiet/comments/v8hz40/where_do_you_draw_the_line_with_processed_food/,1,[removed],PlantBasedDiet,Where do you draw the line with processed food?,https://www.reddit.com/r/PlantBasedDiet/comments/v8hz40/where_do_you_draw_the_line_with_processed_food/,True
peonypetal5,t2_frze2xly,1654784828,v8i19k,0,/r/PlantBasedDiet/comments/v8i19k/healthy_vegan_resources_for_my_boyfriend_who/,1,[removed],PlantBasedDiet,"Healthy Vegan Resources for my boyfriend who likes fast food, soda, and has high cholesterol?",https://www.reddit.com/r/PlantBasedDiet/comments/v8i19k/healthy_vegan_resources_for_my_boyfriend_who/,True
Muay_Thai_Cat,t2_7hcssiui,1654788134,v8j7zs,0,/r/PlantBasedDiet/comments/v8j7zs/skin_cancer_risk_eating_two_portions_of_fish_a/,1,,PlantBasedDiet,"Skin cancer risk: Eating two portions of fish a week could increase the risk of melanoma, study finds | UK News",https://news.sky.com/story/skin-cancer-risk-eating-two-portions-of-fish-a-week-could-increase-the-risk-of-melanoma-study-finds-12630389,False
milkwalkleek,t2_6bk6ock4,1654789621,v8jrky,0,/r/PlantBasedDiet/comments/v8jrky/always_coming_up_short_on_vitamin_e_and_vitamin_k/,1,"I’m trying to transition to being fully plant-based from vegetarian, so I’ve started logging my days into Cronometer. I’ve noticed that I get a surplus of every nutrient except for Vitamin E and Vitamin K. I’m only able to get between 10-20% of my RDA for these. Anyone else have this issue? 

How necessary are E and K for overall health? I don’t really want to supplements, but does anyone have any supplement recommendations for these?",PlantBasedDiet,Always coming up short on Vitamin E and Vitamin K. Any supplements?,https://www.reddit.com/r/PlantBasedDiet/comments/v8jrky/always_coming_up_short_on_vitamin_e_and_vitamin_k/,True
jomtientofu,t2_j4d2n9aq,1654791856,v8kli4,0,/r/PlantBasedDiet/comments/v8kli4/swiss_chard_is_a_beautiful_dark_leafy_green/,1,,PlantBasedDiet,swiss chard is a beautiful dark leafy green ❤️,https://i.redd.it/2nc7v3u6gm491.jpg,False
The_Cabbage_Letters,t2_z8tah,1654792674,v8kw5g,0,/r/PlantBasedDiet/comments/v8kw5g/vegan_refrigerated_probiotics/,1,Does anyone know of any probiotics you can find in the refrigerated sections of say Sprouts or Wal-Mart that are vegan?,PlantBasedDiet,Vegan refrigerated probiotics?,https://www.reddit.com/r/PlantBasedDiet/comments/v8kw5g/vegan_refrigerated_probiotics/,True
