author,author_fullname,created_utc,id,num_comments,permalink,score,selftext,subreddit,title,url,is_self
SirNatcelot,t2_ad8zoj3g,1641010405,rtb7pv,0,/r/vegan/comments/rtb7pv/i_just_wanted_to_share_a_small_victory/,1,"Hey, folks! 

Happy new year to everyone! I just came back for a family dinner I was a little scared of having. It’s my first year as a vegan and the first festivity I actually spent with almost all my family. 

That said, my country is pretty big into meat and my family is not the exception. Festivities and barbecues are basically a common tradition. If you have something to celebrate (New year, Christmas, birthdays, a family reunion…) you are going to have a barbecue. 

Either way, I was really worried about the whole thing and how my family was gonna act. And yes, they were some stupid comments and jokes about not eating animal products, but overall it was pretty great. I brought a vegan lasagna, and some of my folks tried it out and loved it! Even one of my little cousins said he wanted to eat more plant based (not vegan, but he is 11 years so I hope he will get there). And my big cousins cooked me some veggies too! 

I just wanted to share this with y'all. I was expecting dumb comments and feeling left out, but I’m pretty much surprised and happy.

Anyways, have a really good night y’all! Happy new year, and if you feel like sharing how your celebration went, I’m all ears!",vegan,I just wanted to share a small victory!,https://www.reddit.com/r/vegan/comments/rtb7pv/i_just_wanted_to_share_a_small_victory/,True
gh0stegrl,t2_4b8ztx82,1641011363,rtbgp5,0,/r/vegan/comments/rtbgp5/thoughts_on_eating_your_placenta/,1,"Personally, I’m vegan because of the affect it has on the environment and the wellbeing of animals themselves. If these issues were no longer issues I [again] personally don’t see an issue with eating meat. Of course this could never happen unless animals could consent to being literally slaughtered, unless.. So I guess what I’m asking is if any of you have done it, or if you’d see any problems with it that would break your “rules.”",vegan,Thoughts on eating your placenta?,https://www.reddit.com/r/vegan/comments/rtbgp5/thoughts_on_eating_your_placenta/,True
wholesomedumbass,t2_uinqi44,1641012637,rtbsxu,0,/r/vegan/comments/rtbsxu/ending_the_year_properly/,1,,vegan,Ending the year properly,https://i.redd.it/8z4ft4kkb0981.jpg,False
Md_Rafiuddin,t2_9m4fktce,1641013404,rtc0pg,0,/r/vegan/comments/rtc0pg/egg_fried_rice_with_history/,1,,vegan,Egg fried rice with history,https://youtu.be/fVyywcfChz0,False
Retroviking2416,t2_i4ndmcah,1641014094,rtc7iv,0,/r/vegan/comments/rtc7iv/what_im_eating_on_the_new_year/,1,,vegan,What im eating on the new year,https://i.redd.it/wtdfw1htf0981.jpg,False
suckerbucket,t2_10lqu3ue,1641014390,rtca8o,0,/r/vegan/comments/rtca8o/the_fact_that_people_actually_believe_this_satire/,1,,vegan,The fact that people actually believe this satire nonsense is laughable.,https://i.redd.it/216fim7sg0981.jpg,False
ThatCoyoteDude,t2_bqosy2vc,1641016686,rtcwc2,0,/r/vegan/comments/rtcwc2/welcome_to_2020_fellow_vegans/,1,[removed],vegan,Welcome to 2020 fellow vegans,https://www.reddit.com/r/vegan/comments/rtcwc2/welcome_to_2020_fellow_vegans/,True
shannonsurfs,t2_79xtu,1641017314,rtd2hc,0,/r/vegan/comments/rtd2hc/new_years_chocolate_cream_pie_with_baileys/,1,,vegan,New Years chocolate cream pie with Bailey’s whipped cream.,https://i.redd.it/89mz189hp0981.jpg,False
ConclusionBright3221,t2_e963bllf,1641018783,rtdgcx,0,/r/vegan/comments/rtdgcx/vegans_are_fags/,1,[removed],vegan,Vegans are fags,https://www.reddit.com/r/vegan/comments/rtdgcx/vegans_are_fags/,True
Mynameis__--__,t2_mrn2g,1641019851,rtdpws,0,/r/vegan/comments/rtdpws/investing_in_veganism_veganthemed_active_etf/,1,,vegan,Investing in Veganism? Vegan-Themed Active ETF Launches,https://www.etf.com/sections/daily-etf-watch/vegan-themed-active-etf-launches,False
marching-to-the-sea,t2_x887v4g,1641019863,rtdq0w,0,/r/vegan/comments/rtdq0w/vegan_korean_bbq_new_years_eve_feast/,1,,vegan,vegan korean bbq new year’s eve feast ❤️,https://www.reddit.com/gallery/rtdq0w,False
termicky,t2_5h3a8,1641019979,rtdr1d,0,/r/vegan/comments/rtdr1d/i_made_dinner_for_the_extended_family_for_our_new/,1,[removed],vegan,"I made dinner for the extended family for our New Year's get together, and no one commented that it was 100% vegan.",https://www.reddit.com/r/vegan/comments/rtdr1d/i_made_dinner_for_the_extended_family_for_our_new/,True
SpiritualAbodeHeaven,t2_i4nolfk2,1641020215,rtdsxe,0,/r/vegan/comments/rtdsxe/vegan_sub_sandwich_fast_food_spots/,1,[removed],vegan,vegan sub sandwich fast food spots?,https://www.reddit.com/r/vegan/comments/rtdsxe/vegan_sub_sandwich_fast_food_spots/,True
almightyhecz,t2_6kcwa2j7,1641020734,rtdxq8,0,/r/vegan/comments/rtdxq8/new_year_resolution/,1,[removed],vegan,New year resolution,https://www.reddit.com/r/vegan/comments/rtdxq8/new_year_resolution/,True
savindhi77,t2_ao0nboea,1641020958,rtdziz,0,/r/vegan/comments/rtdziz/a_week_in_the_life_of_a_vegan/,1,,vegan,A week in the life of a vegan,https://youtube.com/watch?v=XTcBwlUiQ3Y&amp;feature=share,False
missserpentine,t2_39d9nfst,1641022100,rte97k,0,/r/vegan/comments/rte97k/iso_vegan_german_food_recipes/,1,"Hello! I live in America and have been trying to go vegan! (Actually my new years resolution) My dad's family is fairly recent in America so we still cook more traditional food. I would love to be able to eat the dishes that feel like home again! I am specifically looking for a vegan stollen recipe as that's my absolute favorite. Any German recipes that you can share would be much appreciated! Also, if anyone knows of a vegan kugelis recipe (Lithuanian) I will marry you haha. TIA!",vegan,ISO Vegan German Food Recipes,https://www.reddit.com/r/vegan/comments/rte97k/iso_vegan_german_food_recipes/,True
TheChallengePickle,t2_2liugwdg,1641022560,rtedbm,0,/r/vegan/comments/rtedbm/any_suggestions_to_liven_this_up/,1,,vegan,Any suggestions to liven this up?,https://i.redd.it/tawdxvo251981.png,False
TheChallengePickle,t2_2liugwdg,1641022654,rtee35,0,/r/vegan/comments/rtee35/any_suggestions_how_to_liven_this_up/,1,,vegan,Any suggestions how to liven this up?,https://i.redd.it/mqki07sc51981.png,False
robredzulu,t2_2pzgoxxj,1641023081,rtehvt,0,/r/vegan/comments/rtehvt/vegan_partners_hows_it_going/,1,"  

Long-time lurker but slim contributor here. I find so much inspiration and value on this forum it’s ridiculous. Thank you.

Partners, wives, husbands, Moms or Dads of vegans …. What’s it like? Love them or kill them, PITA and expensive to pander to, somewhere in the middle or did you switch? Me - 52yoM, vegan for prob four years. Sadly, lost a marriage as we were both pretty firm in our lane choice so I’m keen to know your story.",vegan,Vegan partners – how’s it going?,https://www.reddit.com/r/vegan/comments/rtehvt/vegan_partners_hows_it_going/,True
Mistake_On_Earth,t2_ei4v07hy,1641023388,rteket,0,/r/vegan/comments/rteket/bruh_moment/,1,[removed],vegan,Bruh Moment,https://www.reddit.com/r/vegan/comments/rteket/bruh_moment/,True
Good-Impress-1176,t2_ewsz73l9,1641023639,rtemq6,0,/r/vegan/comments/rtemq6/wonderful_vegan_youtubes_to_make_yummy_recipes/,1,[removed],vegan,Wonderful Vegan Youtubes To Make Yummy Recipes You Love?,https://www.reddit.com/r/vegan/comments/rtemq6/wonderful_vegan_youtubes_to_make_yummy_recipes/,True
Good-Impress-1176,t2_ewsz73l9,1641023718,rtenea,0,/r/vegan/comments/rtenea/wonderful_vegan_videos_to_watch_so_we_can_make/,1,[removed],vegan,Wonderful Vegan Videos To Watch So We Can Make Yummy Recipes You Love?,https://www.reddit.com/r/vegan/comments/rtenea/wonderful_vegan_videos_to_watch_so_we_can_make/,True
xOrchidx,t2_5quvaa77,1641024186,rterqp,0,/r/vegan/comments/rterqp/what_about_horses/,1,[removed],vegan,What about horses,https://www.reddit.com/r/vegan/comments/rterqp/what_about_horses/,True
bleachisverytasty,t2_i3m0nkee,1641025924,rtf6u0,0,/r/vegan/comments/rtf6u0/we_need_to_talk_about_nice_vegans/,1,[removed],vegan,"We need to talk about ""nice vegans""",https://www.reddit.com/r/vegan/comments/rtf6u0/we_need_to_talk_about_nice_vegans/,True
blizeH,t2_3ai7c,1641026272,rtf9kw,0,/r/vegan/comments/rtf9kw/3_new_vegan_krispy_kreme_flavours_uk/,1,,vegan,3 new vegan Krispy Kreme flavours (U.K.),https://i.imgur.com/Tg3wVlI.jpg,False
hungry-mongoose,t2_5sqd7w4x,1641028922,rtfvof,0,/r/vegan/comments/rtfvof/i_think_this_book_my_mum_bought_for_my_daughter/,1,,vegan,I think this book my mum bought for my daughter will be getting donated.,https://i.redd.it/cbg3unozn1981.jpg,False
pineapplepizza221,t2_e2hac4di,1641029678,rtg1r5,0,/r/vegan/comments/rtg1r5/james_aspey/,1,[removed],vegan,James Aspey,https://www.reddit.com/r/vegan/comments/rtg1r5/james_aspey/,True
Muay_Thai_Cat,t2_7hcssiui,1641030755,rtgaho,0,/r/vegan/comments/rtgaho/pbn_vegan_movie_2021/,1,,vegan,PBN Vegan Movie 2021,https://youtu.be/NBMXh5z9XVU,False
No_beef_here,t2_hmuisk4j,1641036526,rthnd5,0,/r/vegan/comments/rthnd5/veganurary_campaign_lost_some_focus/,1,"HNY to all.

I was checking out [www.veganuary.com](https://www.veganuary.com) and it seems to put quite a lot of focus on the environment and what people eat, rather than the animal rights / suffering?

I thought the vegan philosophy was mostly about the animals and whilst us refraining from keeping and killing \~80+ Billion of them every year would reduce loads of other negative things (MMGW &gt; climate change , pollution), even if going vegan didn't have those benefits, we would still be morally obliged to leave the animals alone?

Or is it \*just\* marketing where they are trying all the angles in the hope that people reduce their meat intake for whatever reason on the grounds that that's the goal, even if not for the 'right' reason?

My worry is the animal part of the message gets diluted and / or it provides more rabbit holes for people to argue down?",vegan,Veganurary campaign lost some focus?,https://www.reddit.com/r/vegan/comments/rthnd5/veganurary_campaign_lost_some_focus/,True
DJChimp88,t2_8go1xsu8,1641037822,rthy0p,0,/r/vegan/comments/rthy0p/happy_new_vegan_year/,1,"Happy New Year everyone!  I hope this post finds you in good spirits.  2022 is finally here and we should be thankful that the clock has reset; allowing us another opportunity to live life and enjoy one another.  These last two years have been daunting, BUT I always try and find some good from any situation.  The pandemic has forced society to take a second look at not only viruses and diseases, but overall health.  More individuals are realizing that one of the main factors for being healthy is diet, so lets make 2022 a year of ""Vegan Revolution"" and start to promote more of this lifestyle and education the public with the hopes that with enough information and influence that society will convert over to the green vs the red...🌱",vegan,"Happy New ""Vegan"" Year!!!...🎉",https://www.reddit.com/r/vegan/comments/rthy0p/happy_new_vegan_year/,True
Njaulv,t2_egnnrhjr,1641038010,rthzqy,0,/r/vegan/comments/rthzqy/happy_veganuary_everyone_that_is_here_and_new/,1,,vegan,Happy Veganuary everyone that is here and new!,https://www.reddit.com/r/vegan/comments/rthzqy/happy_veganuary_everyone_that_is_here_and_new/,True
darkmoncns,t2_34veiovx,1641038577,rti4yh,0,/r/vegan/comments/rti4yh/is_the_oreo_vegan/,1,[removed],vegan,Is the oreo vegan?,https://www.reddit.com/r/vegan/comments/rti4yh/is_the_oreo_vegan/,True
DJChimp88,t2_8go1xsu8,1641038919,rti7wn,0,/r/vegan/comments/rti7wn/health_illustrated_3_vegan_myths_debunked/,1,,vegan,Health Illustrated (3 Vegan Myths Debunked)...🌱,https://i.redd.it/havl1q3ff2981.jpg,False
tofu-titan,t2_fsb04syc,1641039269,rtib0n,0,/r/vegan/comments/rtib0n/vivisection_animal_testing_equipment/,1,,vegan,Vivisection Animal Testing Equipment,https://animaltestingpictures.com/animal-testing-equipment/,False
shellfish_lobster,t2_eblhnuwq,1641039897,rtight,0,/r/vegan/comments/rtight/vegan_food_production_and_animal_suffering/,1,"Is it ethical for you to eat anything? Because food production is inseparable from animal suffering. How are you in any way better than meat eaters if the production of your food is causing countless insects, small mammals and their predators, to be poisoned by pesticides and killed by machinery.

You are choosing to lower your quality of life with the goal to reduce animal death and usage. But why do you abstain from directly using animal products but are using more plant food than you need to survive over the timespan that you want to live, have children who are doing the same etc. 

Suicide would the only way to not harm any animal. The most extreme sacrifice that a human could make for their beloved animal friends. Obviously not the right choice. So think about the possibility that we could use animals properly to live a good live.",vegan,vegan food production and animal suffering,https://www.reddit.com/r/vegan/comments/rtight/vegan_food_production_and_animal_suffering/,True
Feedo420,t2_63r9kjuk,1641040037,rtihl9,0,/r/vegan/comments/rtihl9/why_are_so_many_vegans_against_vaccines/,1,"Recently I came across this post on instagram account @plantbasednews (quite popular) where this guy was basically saying that there’s some vegan vaccine etc. but what really surprised me were the comments. It was flooded with antivaxx comments, there was just so many of them I couldn’t believe it. Aren’t we like with science or stuff like that? Isn’t there enough proof that vaccines work? I kind of thought we aren’t those crystal worshiping guys lol. Why is it like this?",vegan,Why are so many vegans against vaccines?,https://www.reddit.com/r/vegan/comments/rtihl9/why_are_so_many_vegans_against_vaccines/,True
BlzeRaey,t2_7aruzj8h,1641040179,rtiiqw,0,/r/vegan/comments/rtiiqw/these_chips_are_so_nice_btw_they_not_vegan_i_ate/,1,,vegan,These chips are so nice btw they not vegan i ate entire turkey yestarday and then i ate dog it was very nice.,https://i.redd.it/zju8scvgl2981.jpg,False
GoVegan66,t2_i4yu5yjc,1641041262,rtisg0,0,/r/vegan/comments/rtisg0/introduction_and_new_book/,1,[removed],vegan,Introduction and New Book!!,https://www.reddit.com/r/vegan/comments/rtisg0/introduction_and_new_book/,True
gizmo_and_taja,t2_4tn3qutz,1641042777,rtj6qk,0,/r/vegan/comments/rtj6qk/vaxxed_bots/,1,[removed],vegan,Vaxxed bots,https://www.reddit.com/r/vegan/comments/rtj6qk/vaxxed_bots/,True
TrainerjohnGreninja,t2_cbatcdlv,1641043684,rtjeyg,0,/r/vegan/comments/rtjeyg/why/,1,[removed],vegan,Why,https://www.reddit.com/r/vegan/comments/rtjeyg/why/,True
Porkchopsandwhichs,t2_7r25mfri,1641044121,rtjjdz,0,/r/vegan/comments/rtjjdz/daiya_cheesecake/,1,[removed],vegan,Daiya Cheesecake 🤤,https://www.reddit.com/r/vegan/comments/rtjjdz/daiya_cheesecake/,True
etnihiletnihil,t2_e6j8nfta,1641044208,rtjk7f,0,/r/vegan/comments/rtjk7f/veganniversay/,1,[removed],vegan,Veganniversay,https://www.reddit.com/r/vegan/comments/rtjk7f/veganniversay/,True
CheddarGoblin99,t2_73tpiirz,1641044917,rtjr3y,0,/r/vegan/comments/rtjr3y/progress_is_being_made_out_of_my_family_of_10/,1,,vegan,"Progress is being made out of my family of 10 people, 3 of us are vegan. A new years eve meal 3 years ago would be 90% meat, now only the circled stuff is not vegan!!!!",https://www.reddit.com/gallery/rtjr3y,False
costaaa_,t2_8f53w4re,1641044970,rtjrlz,0,/r/vegan/comments/rtjrlz/alternative_to_sudocrem/,1,[removed],vegan,Alternative to sudocrem?,https://www.reddit.com/r/vegan/comments/rtjrlz/alternative_to_sudocrem/,True
sdbest,t2_330cv,1641045053,rtjsm2,0,/r/vegan/comments/rtjsm2/the_national_security_case_for_labgrown_and/,1,,vegan,The National Security Case for Lab-Grown and Plant-Based Meat,https://slate.com/technology/2021/12/plant-cultivated-meat-national-security.html,False
bearfacelager,t2_3jqakipf,1641045480,rtjwt1,0,/r/vegan/comments/rtjwt1/involving_omni_family_in_veganuary/,1,,vegan,Involving omni family in veganuary!,https://i.imgur.com/xfDMUhr.jpg,False
TheRealEveryoneWant,t2_aldqidyx,1641046284,rtk5r8,0,/r/vegan/comments/rtk5r8/my_mom_make_a_vegan_kebab_for_me_how_wonderfull/,1,,vegan,my mom make a vegan kebab for me how wonderfull is that,https://i.redd.it/2umynndm33981.jpg,False
grumpyCaribou0,t2_i45y8dmq,1641046413,rtk72c,0,/r/vegan/comments/rtk72c/vegan_meat_brand_wins_entrepreneur_of_the_year/,1,,vegan,Vegan Meat Brand Wins Entrepreneur of the Year Award in Spain?,https://vegnews.com/2021/1/vegan-meat-brand-wins-entrepreneur-of-the-year-award-in-spain,False
monemori,t2_1idgb8uq,1641047333,rtkgej,0,/r/vegan/comments/rtkgej/new_years_eve_dinner_with_friends_lasagna_spanish/,1,,vegan,"New Years Eve dinner with friends! Lasagna, Spanish baked rice, artisanal cheeses and ham, and carrot lox toasts with cream cheese and capers 🌱",https://www.reddit.com/gallery/rtkgej,False
GoVegan66,t2_i4yu5yjc,1641047469,rtki1j,0,/r/vegan/comments/rtki1j/new_book/,1,,vegan,New Book,https://www.livestockslongershadow.com/,False
supermaurer,t2_3a6o8wcd,1641047811,rtklkw,0,/r/vegan/comments/rtklkw/why_is_it_that_in_the_vegan_subreddit_all_people/,1,[removed],vegan,"Why is it that in the vegan subreddit, all people talk about is meat?",https://www.reddit.com/r/vegan/comments/rtklkw/why_is_it_that_in_the_vegan_subreddit_all_people/,True
Possible_Pin4117,t2_82sxsmy2,1641047915,rtkmn5,0,/r/vegan/comments/rtkmn5/earths_island_cheddar_melts_sooooo_well_also/,1,,vegan,"Earth's Island cheddar melts sooooo well. Also, homemade vegan za is the best!",https://i.redd.it/l9dnjcrg83981.jpg,False
The_RyanDaFire,t2_dg4zbb8b,1641048001,rtknlu,0,/r/vegan/comments/rtknlu/login_instagram_damn/,1,,vegan,Login • Instagram damn...,https://www.instagram.com/p/CX60n91Bc1B/?utm_medium=copy_link,False
etnihiletnihil,t2_e6j8nfta,1641048387,rtkrx9,0,/r/vegan/comments/rtkrx9/veganniversay/,1,[removed],vegan,Veganniversay,https://www.reddit.com/r/vegan/comments/rtkrx9/veganniversay/,True
SubmissiveFish805,t2_5x6hw9v8,1641048557,rtktm0,0,/r/vegan/comments/rtktm0/happy_new_year_starting_the_year_off_on_a_good/,1,,vegan,Happy New Year!!! Starting the year off on a good foot. Biscuits and Gravy with Cara Cara Oranges andy new Mandalorian mug. 🎉🎊(recipe in second pic),https://www.reddit.com/gallery/rtktm0,False
a_big_fish,t2_hz3srk2t,1641049208,rtl098,0,/r/vegan/comments/rtl098/cows_to_humans_ratio/,1,[removed],vegan,Cows to humans ratio?,https://www.reddit.com/r/vegan/comments/rtl098/cows_to_humans_ratio/,True
tive-an-25,t2_90ufwzor,1641049612,rtl4vu,0,/r/vegan/comments/rtl4vu/vegan_for_life/,1,,vegan,vegan for life 💚,https://i.redd.it/d0ob8m1hd3981.png,False
Over-Tonight367,t2_92gsm7dz,1641051070,rtlky2,0,/r/vegan/comments/rtlky2/ever_hear_of_hot_chocolate_with_turkish_delight/,1,,vegan,"Ever hear of hot chocolate with Turkish delight plopped in it, Rather than marshmallow floating on top? Neither had I until today. #veganuary",https://i.redd.it/09s7omfuh3981.jpg,False
yegtina,t2_ef0bpql7,1641051217,rtlmoa,0,/r/vegan/comments/rtlmoa/vegan_crunchwrap/,1,,vegan,Vegan Crunchwrap,https://i.redd.it/3656fqfai3981.jpg,False
ChefBoyAn,t2_4w20qh53,1641051221,rtlmpz,0,/r/vegan/comments/rtlmpz/vegan_meatballs/,1,,vegan,"Vegan ""Meatballs""",https://i.redd.it/jyzl9dwai3981.jpg,False
stan-k,t2_8l41z6qh,1641051443,rtlpab,0,/r/vegan/comments/rtlpab/reason_146_not_going_vegan_wastes_a_lot_of_food/,1,,vegan,Reason 146: Not going vegan wastes a lot of food...,https://i.redd.it/0xfeexapi3981.png,False
BrownsCavsGuardians,t2_fc0aw7al,1641051519,rtlq77,0,/r/vegan/comments/rtlq77/on_a_post_exposing_a_woman_who_owns_ducks/,1,,vegan,On a post exposing a woman who owns ducks covering them in oil so she can “rescue” them on social media for clout.,https://i.imgur.com/8YfV6sd.jpg,False
silatone33,t2_5w5o22qe,1641052233,rtlydu,0,/r/vegan/comments/rtlydu/good_advice/,1,,vegan,Good advice,https://i.redd.it/5q8b6obbl3981.jpg,False
silatone33,t2_5w5o22qe,1641052252,rtlylm,0,/r/vegan/comments/rtlylm/this_happens_all_the_time/,1,,vegan,This happens all the time,https://i.redd.it/g8yp9kcdl3981.jpg,False
ScreenHype,t2_bcq0jzv2,1641053328,rtmb8d,0,/r/vegan/comments/rtmb8d/trolley_problem/,1,"I've seen the word 'speciesist' come up a lot in this sub, and so I was curious about the general consensus. Personally, I think you can advocate for the abolition of the animal agriculture industry whilst still putting human lives first seeing as we can survive perfectly well without abusing animals. But other people think that our lives have equal value. So I thought I'd see if I'm really in the minority by using a thought experiment.

There's a trolley hurtling down a track, and on its current path, it would hit a human and a sheep. You have access to three levers. The first would transfer the trolley to a track which hits a sheep. The second would transfer the trolley to a track that hits a human. The third lever is unlabelled, and would randomly transfer the trolley to either the human or the sheep. 

For this thought experiment, you have zero knowledge about the morality of the human on the tracks. Any living creatures on the tracks would be instantly killed if the trolley hits them.

[View Poll](https://www.reddit.com/poll/rtmb8d)",vegan,Trolley problem,https://www.reddit.com/r/vegan/comments/rtmb8d/trolley_problem/,True
Equivalent_Name4643,t2_84bkyoq8,1641054757,rtms3s,0,/r/vegan/comments/rtms3s/recommendations_for_a_good_brand_of_oat_milk/,1,[removed],vegan,Recommendations for a good brand of Oat Milk?,https://www.reddit.com/r/vegan/comments/rtms3s/recommendations_for_a_good_brand_of_oat_milk/,True
left-handy,t2_7j1wkn3n,1641055114,rtmwfk,0,/r/vegan/comments/rtmwfk/my_sisterinlaw_who_isnt_vegan_made_me_a_dessert/,1,,vegan,"My sister-in-law who isn’t vegan made me a dessert box for Christmas with at least 5 different pastries. I would be lying if I said I didn’t cry :,)",https://i.redd.it/kqh2x8jvt3981.jpg,False
hipster_rebbe,t2_52hr3ult,1641055471,rtn0rg,0,/r/vegan/comments/rtn0rg/he_was_only_a_gorilla/,1,,vegan,“He was ‘only’ a gorilla…”,https://i.redd.it/7e5dxauxu3981.jpg,False
quickquestiondotcom,t2_gqyrcywa,1641055718,rtn3re,0,/r/vegan/comments/rtn3re/stop_posting_pictures_of_food/,1,[removed],vegan,stop posting pictures of food,https://www.reddit.com/r/vegan/comments/rtn3re/stop_posting_pictures_of_food/,True
quickquestiondotcom,t2_gqyrcywa,1641056429,rtnci8,0,/r/vegan/comments/rtnci8/please_dont_vote_if_you_are_participating_in_the/,1,"do you support veganuary? 

if i didn't include your option, please comment.

if you are participating in veganuary, please do not vote.

[View Poll](https://www.reddit.com/poll/rtnci8)",vegan,please don't vote if you are participating in the occasion in question,https://www.reddit.com/r/vegan/comments/rtnci8/please_dont_vote_if_you_are_participating_in_the/,True
Karens_Cooking_sucks,t2_i1186vr4,1641056995,rtnjnp,0,/r/vegan/comments/rtnjnp/how_to_lose_weight_forever_2ndbreakfast_pt6/,1,,vegan,How to Lose Weight Forever: ) 2nd-Breakfast... pt.6,https://m.youtube.com/watch?v=fkFJM3rcmLg,False
pikyoo,t2_70w0tzmt,1641057040,rtnk7g,0,/r/vegan/comments/rtnk7g/eggs_are_good_for_women/,1,"So I told my MIL I am going vegan recently, I postponed because I wasn’t sure how I wanted to announce it to my family, anyways her son and daughter are also vegan. She says what’s in the title after I told her. I’m just curious because I was dumbfounded what responses do you have for a comment like this. Thanks in advance!",vegan,Eggs are good for women,https://www.reddit.com/r/vegan/comments/rtnk7g/eggs_are_good_for_women/,True
snowfallingslow,t2_409ky0cq,1664589147,xsiy0b,0,/r/PlantBasedDiet/comments/xsiy0b/best_way_to_eat_fruits_other_than_whole/,1,"I know it’s odd but I can’t handle the texture of fresh fruits unless they’re blended or dehydrated (with one exception for banana). The only way I’ve ever been able to eat fruits is in fruit smoothies, but I was wondering if there was any other way I could get my fruit intake in. I thought about dried fruits, but I’ve heard they’re unhealthy and have a lot of sugar?",PlantBasedDiet,Best way to eat fruits other than whole?,https://www.reddit.com/r/PlantBasedDiet/comments/xsiy0b/best_way_to_eat_fruits_other_than_whole/,True
Beau_zwitsers,t2_sz7cnwii,1664615080,xsqkqc,0,/r/PlantBasedDiet/comments/xsqkqc/1_month_vegan_challenge/,1,[removed],PlantBasedDiet,1 month vegan challenge,https://www.reddit.com/r/PlantBasedDiet/comments/xsqkqc/1_month_vegan_challenge/,True
Hotpooriz_Vegan_gf,t2_jmrryfy4,1664617246,xsr5mu,0,/r/PlantBasedDiet/comments/xsr5mu/cheesy_bread_pizza_with_flour_cheese_broccoli_and/,1,,PlantBasedDiet,"Cheesy bread pizza with flour cheese , Broccoli and sesame seeds as toppings",https://youtu.be/hTcKJi1KweY,False
Helpmeimtired17,t2_n7xlbwoe,1664621350,xssa96,0,/r/PlantBasedDiet/comments/xssa96/savory_breakfast/,1,"I really really love savory breakfast. And I like tofu scrambles well enough! But I’m wondering what are your personal flavor boosting tricks?! 

I’m making avocado and fried tofu breakfast sandwiches tomorrow and have a scramble today. 

What are your other savory favorites?",PlantBasedDiet,Savory breakfast,https://www.reddit.com/r/PlantBasedDiet/comments/xssa96/savory_breakfast/,True
FoldsPerfect,t2_38472xu4,1664628688,xsuj1l,0,/r/PlantBasedDiet/comments/xsuj1l/im_so_close_to_rage_quitting_this_diet/,1,"So how am I supposed to get over a hundred grams of fiber in this f*cked up world where we feed products to children? Nevertheless the less than half minimum of that, being 47 grams? Eat beans all day? Just one bowl of oatmeal makes me full.",PlantBasedDiet,I’m so close to rage quitting this diet,https://www.reddit.com/r/PlantBasedDiet/comments/xsuj1l/im_so_close_to_rage_quitting_this_diet/,True
