author,author_fullname,created_utc,id,num_comments,permalink,score,selftext,subreddit,title,url,is_self
aIIisonmay,t2_fioduy9y,1664582453,xsgm3o,1,/r/vegan/comments/xsgm3o/which_dairy_corporations_are_the_most_responsible/,1,"Hello! I'm vegan and I'm making a Power Point about veganism to present to my omnivore friends. I have a section where I talk about ethics, so of course I bring up factory farming. I want to have a list of specific dairy brands that are the biggest users of factory farming, but I'm having a hard time finding much information. I'm sure that's just because dairy brands want you to believe their cows live in a happy dreamland and not in the horrific conditions that they do.

If you have any info on this (or any other relevant info that I could include in my Power Point) please let me know!",vegan,Which dairy corporations are the most responsible for factory farming?,https://www.reddit.com/r/vegan/comments/xsgm3o/which_dairy_corporations_are_the_most_responsible/,True
deepnek,t2_4nemzh03,1664582537,xsgn7o,0,/r/vegan/comments/xsgn7o/anyone_else_get_sick_to_their_stomach_everytime/,1,[removed],vegan,Anyone else get sick to their stomach everytime they grocery shop from the scent of raw meat and abuse?,https://www.reddit.com/r/vegan/comments/xsgn7o/anyone_else_get_sick_to_their_stomach_everytime/,True
FloNightG123,t2_ggf8ss2i,1664583242,xsgwhr,0,/r/vegan/comments/xsgwhr/windy_lentils/,1,[removed],vegan,Windy lentils,https://www.reddit.com/r/vegan/comments/xsgwhr/windy_lentils/,True
Thatcoonfella,t2_qbozi,1664584319,xsha31,0,/r/vegan/comments/xsha31/vegan_chocolate_made_in_keizer_oregon_the_peanut/,1,,vegan,"Vegan chocolate made in Keizer, Oregon. The peanut butter cups are better then Reece’s",https://i.redd.it/ztrgoa7aa3r91.jpg,False
tazzysnazzy,t2_4dvyf,1664584953,xshi92,1,/r/vegan/comments/xshi92/omnis_are_running_out_of_excuses/,1,,vegan,Omnis are running out of excuses,https://theveganherald.com/2022/09/muscle-protein-synthetic-response-to-plant-protein-does-not-differ-from-animal-protein-finds-study/,False
jlbucz,t2_2u8w1lpv,1664585211,xshlfs,1,/r/vegan/comments/xshlfs/i_selfishly_hope_more_people_give_up_meatgo_vegan/,1,"*spoiler alert! Don’t read if you plan on watching the series*

As I’m watching the Netflix series Dahmer, I can’t help but think to myself, as the scenes come on the screen where human flesh is being served as food, “why would anyone think *that’s* bad, but not animal flesh?”

The series is so disturbing and made me sick to my stomach.

Did anyone else feel this way as they watched?",vegan,I selfishly hope more people give up meat/go vegan after watching the Dahmer series.,https://www.reddit.com/r/vegan/comments/xshlfs/i_selfishly_hope_more_people_give_up_meatgo_vegan/,True
Gabzamillion,t2_iyitbp0b,1664585758,xshs9q,0,/r/vegan/comments/xshs9q/unpopular_opinion_nooch_is_a_gross_nickname_for/,1,,vegan,Unpopular opinion: Nooch is a gross nickname 🤮 for such a great food. Anyone else agree?,https://i.redd.it/gifgk07ke3r91.jpg,False
TheVeganDragon_,t2_qboeung3,1664586238,xshy75,1,/r/vegan/comments/xshy75/ban_traveling_animal_acts_in_pwc/,1,[removed],vegan,Ban Traveling Animal Acts in PWC,https://www.reddit.com/r/vegan/comments/xshy75/ban_traveling_animal_acts_in_pwc/,True
shahstakovich,t2_rufxl82b,1664587934,xsij9j,1,/r/vegan/comments/xsij9j/kittengate_outrage_after_climate_scientist_feeds/,1,,vegan,KITTENGATE: Outrage After Climate Scientist Feeds Kittens to Diners,https://youtu.be/yrf1TWpKCeI,False
RealCrashninja,t2_erc9r9c3,1664588384,xsioph,0,/r/vegan/comments/xsioph/tasty/,1,,vegan,tasty,https://i.redd.it/u8v3fogdm3r91.jpg,False
veganactivismbot,t2_2xq9ryss,1664588498,xsiq27,2,/r/vegan/comments/xsiq27/ban_traveling_animal_acts_in_pwc/,1,,vegan,Ban Traveling Animal Acts in PWC,/r/VeganActivism/comments/xsipxe/ban_traveling_animal_acts_in_pwc/,False
larsandthemoon,t2_c0sy0s8i,1664589067,xsix1m,0,/r/vegan/comments/xsix1m/what_are_some_ways_to_make_vegetables_tasty_when/,1,[removed],vegan,What are some ways to make vegetables tasty when cooking?,https://www.reddit.com/r/vegan/comments/xsix1m/what_are_some_ways_to_make_vegetables_tasty_when/,True
VexxxVortex,t2_eglx2si2,1664589499,xsj252,0,/r/vegan/comments/xsj252/surprise_vegan_ravioli/,1,,vegan,Surprise vegan ravioli!,https://www.reddit.com/gallery/xsj252,False
VeganPizzaPie,t2_hbnwh0nh,1664590399,xsjdc7,0,/r/vegan/comments/xsjdc7/found_myself_unexpectedly_in_la_for_the_evening/,1,,vegan,Found myself unexpectedly in LA for the evening and discovered Hood Ramen - 100% vegan and apparently run by a former Top Chef winner?,https://i.redd.it/bm9io4tcs3r91.jpg,False
valeriegovegan,t2_f679rics,1664590608,xsjfth,1,/r/vegan/comments/xsjfth/log_into_facebook/,1,,vegan,Log into Facebook,https://m.facebook.com/story.php?story_fbid=pfbid02arWd2S334zd8Vd3MUotAkpVZYwbXyNRi7hqtr2YFKtG6NjkbH7TzHZENiR96vpW5l&amp;id=1831745017&amp;sfnsn=mo,False
Saveyourgrade,t2_t6b2e,1664590738,xsjhco,0,/r/vegan/comments/xsjhco/the_irony/,1,"I just can’t conceive how we’re okay with this kind of labeling as a society but simultaneously know that this is also who we are as a species. We deceive ourselves the most. Yet I know this group of people will understand the irony. Makes me think of the steak in the matrix on some level.


Read this from “South to America” by Imani Perry and it moved me:

“Dreaming isn’t dead. It can’t be. We can do it anew. Me and you, both of us are required. I believe writing can be a moral instrument if it asks you to do more than read. Do you?” 

And this

“Isn’t that what we want, that irrepressible hope? Maybe it isn’t just an American mythos. Maybe it’s an American wonder. After all, from the bottom, from the depths, from the fields, from the ashes, hope just keeps on rising and radiating off sweat-glowing skin in Southern heat. “",vegan,The irony.,https://i.redd.it/olqh4zzct3r91.jpg,False
valeriegovegan,t2_f679rics,1664590867,xsjivw,1,/r/vegan/comments/xsjivw/log_into_facebook/,1,,vegan,Log into Facebook,https://m.facebook.com/story.php?story_fbid=pfbid02arWd2S334zd8Vd3MUotAkpVZYwbXyNRi7hqtr2YFKtG6NjkbH7TzHZENiR96vpW5l&amp;id=1831745017,False
Fantastic_Ad7023,t2_5jc5tjgy,1664592042,xsjwxr,0,/r/vegan/comments/xsjwxr/helpful_charts/,1,,vegan,Helpful charts,https://www.reddit.com/gallery/xsjwxr,False
One-Treacle-1037,t2_sqj9gbz7,1664594962,xskvhd,1,/r/vegan/comments/xskvhd/al_electrocution_by_devourment_sounds_like_the/,1,[removed],vegan,A**l electrocution by devourment sounds like the life that animals go through in fur farms,https://www.reddit.com/r/vegan/comments/xskvhd/al_electrocution_by_devourment_sounds_like_the/,True
One-Treacle-1037,t2_sqj9gbz7,1664595275,xskz52,1,/r/vegan/comments/xskz52/kings_guards_and_bearskins/,1,"After Queen Elizabeth ii passed away at age 96, People Still campaign for bearskins to be replaced with Plastic sustainable Alternatives. American black Bears(Urdu’s americanus) in Canada and United States Are Shot In the Head, Had Their Cubs Bludgeoned Or clubbed to death Thrashed Against bullbars Of Trucks Or Left To starve Or Eaten By Predators. Campaigners Often Attack the King’s Guard For Wearing Dead Bears Around Their Heads As A Ceremony. Not Only That They Also Are Wearing leather shoes of cows Who are skinned alive in factory farms.",vegan,King’s Guards and Bearskins,https://www.reddit.com/r/vegan/comments/xskz52/kings_guards_and_bearskins/,True
iwanttobeacavediver,t2_d0c84dq0,1664598668,xsm2d0,1,/r/vegan/comments/xsm2d0/so_i_tried_eating_vegan_for_24_hours_it_was_so/,1,"After my last post I decided on ‘testing the waters’ so to speak and decided to spend the day yesterday eating vegan. I tried staying away from processed foods (they’re expensive here!). 

Breakfast- banh tieu. This is a sort of bun which has sesame seeds on it. I love these and know exactly where to go to get definitely vegan ones. Paired with a Vietnamese coffee it was good (and even better with peanut butter). Plus there are street sellers with these all over so they’re easy to find. 

Lunch- I was super lazy and used GrabFood (the local UberEats here) to order from my usual restaurant. I had Hue style noodles and they tasted so good I ate the full bowl. Also had some dragonfruit and pineapple afterwards. 

Dinner- I was lazy and cooked rice with veg, lotus tofu and chili sauce. Tasted good for something I made up by myself. I also ate more pineapple because I love the stuff. 

I ended up not bothering with supper or snacks because I was stuffed. I also remembered how much I enjoyed straight black Vietnamese coffee during the day too. 

This is awesome!",vegan,So I tried eating vegan for 24 hours. It was so easy.,https://www.reddit.com/r/vegan/comments/xsm2d0/so_i_tried_eating_vegan_for_24_hours_it_was_so/,True
plantbasedbrownie,t2_971cpc5s,1664600078,xsmhi1,0,/r/vegan/comments/xsmhi1/pumpkin_spice_szn_meaning_its_time_to_whip_out/,1,,vegan,pumpkin spice szn 🎃 meaning it’s time to whip out the vegan pumpkin pancakes xD,https://v.redd.it/9onc20u4l4r91,False
BoundariesAreFun,t2_4i7lrrix,1664601254,xsmu41,1,/r/vegan/comments/xsmu41/25_accidentally_vegan_snacks_you_can_find_at/,1,,vegan,25 Accidentally Vegan Snacks You Can Find at Virtually Any Convenience Store,https://vegnews.com/2022/9/25-accidentally-vegan-snacks-that-you-can-find-at-a-convenience-store,False
Kitchen-Garden-733,t2_7qx5yvpq,1664602529,xsn7az,1,/r/vegan/comments/xsn7az/operation_deathstar_trial_starts_monday_oct_3/,1,"Two animal rights activists face felony charges and 11 years in prison for rescuing two dying piglets from a Smithfield concentration camp in Utah.  [https://kslnewsradio.com/1976167/nations-largest-pig-farm-exposed-two-face-criminal-charges/](https://kslnewsradio.com/1976167/nations-largest-pig-farm-exposed-two-face-criminal-charges/)

[https://www.facebook.com/events/601097851196328/?ref=newsfeed](https://www.facebook.com/events/601097851196328/?ref=newsfeed)

Wayne Hsiung is a co-founder of DxE and he is posting updates.   I will be there on Tuesday to support them.  [https://thesanctuaryinitiative.org/episodes/paul-and-jon](https://thesanctuaryinitiative.org/episodes/paul-and-jon)

[https://simpleheart.substack.com/p/my-last-thought-before-the-trial?fbclid=IwAR2aBXEkONL7J5kuTEUhef3-SmMum\_sBopaCbIHhIlqn7gyiBuxyQbuWUeQ](https://simpleheart.substack.com/p/my-last-thought-before-the-trial?fbclid=IwAR2aBXEkONL7J5kuTEUhef3-SmMum_sBopaCbIHhIlqn7gyiBuxyQbuWUeQ)

[https://www.facebook.com/wayne.hsiung](https://www.facebook.com/wayne.hsiung)",vegan,"Operation Deathstar trial starts Monday, Oct 3",https://www.reddit.com/r/vegan/comments/xsn7az/operation_deathstar_trial_starts_monday_oct_3/,True
lostinflax,t2_k0md8nwf,1664602806,xsna2c,0,/r/vegan/comments/xsna2c/hi_guys_im_compiling_a_list_of_awesome_vegan/,1,[removed],vegan,"Hi guys, I’m compiling a list of awesome vegan restaurants, bakeries and cafes for my own travel list — any recommendations? What are your must-try’s? Thank you!🌿🌞",https://www.reddit.com/r/vegan/comments/xsna2c/hi_guys_im_compiling_a_list_of_awesome_vegan/,True
Sure-Rub-8843,t2_pir2wvgk,1664604503,xsnrej,0,/r/vegan/comments/xsnrej/spritualknowedge_aboutnavratri/,1,,vegan,#spritualknowedge_aboutnavratri,https://i.redd.it/5dgtlpsay4r91.jpg,False
soyelvegano,t2_f8c2eo3e,1664604513,xsnri9,0,/r/vegan/comments/xsnri9/soyelvegano/,1,,vegan,@soyelvegano,https://i.redd.it/u6mmyivby4r91.jpg,False
user_mo,t2_6jpkny4i,1664604518,xsnrk9,1,/r/vegan/comments/xsnrk9/cheesy_seitan/,1,"hi everyone. i’ve attempted to make seitan 3 times, each a different recipe &amp; method of cooking but the same resulting flavor. it taste like cheese…. it has a weird cheesy taste to it and i’ve even omitted adding nutritional yeast to the recipes i’ve made but it still taste like cheese. has this ever happened to anyone else???",vegan,cheesy seitan,https://www.reddit.com/r/vegan/comments/xsnrk9/cheesy_seitan/,True
opsbnek,t2_svqxzv68,1664604866,xsnv78,1,/r/vegan/comments/xsnv78/sm_seeking_for_sb/,1,[removed],vegan,Sm seeking for sb 🥰🥰,https://www.reddit.com/r/vegan/comments/xsnv78/sm_seeking_for_sb/,True
crossrolls,t2_2p31u2ng,1664605433,xso0ps,1,/r/vegan/comments/xso0ps/why_does_not_milk_taste_like_coconut_to_me/,1,"I'm a big fan of Silk Next Milk, but I thought I'd try Not Milk this time. I found it tasted very much like coconut milk, but it's not in the ingredients list. Did they add coconut flavor? I checked other reviews, some people say it's very close to the real thing, but for me it just tasted like diluted coconut milk.",vegan,Why does Not Milk taste like coconut (to me)?,https://www.reddit.com/r/vegan/comments/xso0ps/why_does_not_milk_taste_like_coconut_to_me/,True
Such-Comment5642,t2_6bf4yr57,1664606547,xsoblh,1,/r/vegan/comments/xsoblh/just_asking_vegans_their_thoughts_on_this/,1,,vegan,just asking vegans their thoughts on this,https://youtu.be/xL4EkaI0PWI,False
IMadeFetchHappen,t2_u3d07,1664608927,xsoyq4,1,/r/vegan/comments/xsoyq4/looking_for_a_vegan_alternative_to_shellacbased/,1,"I'm planning to modify and paint a couple of flatpack furniture items, so have been reading up on ikeahackers.net and similar sites about how to prepare the laminate surface for painting. 

Everything I've found on general DIY sites and forums recommends shellac-based primer, which obviously I don't want to be using. Has anyone here had a similar project and found a vegan alternative that adheres to laminate in the same way?

It doesn't look like sanding off the laminate is going to be an option, as it's chipboard underneath and I'm not too confident it'd have much integrity without the ""wrapper"".",vegan,Looking for a vegan alternative to shellac-based primer (DIY/upcycling),https://www.reddit.com/r/vegan/comments/xsoyq4/looking_for_a_vegan_alternative_to_shellacbased/,True
JonMor45,t2_h8ocf7z,1664610468,xspdka,0,/r/vegan/comments/xspdka/yet_another_disgusting_bacon_page_suggested_on_my/,1,,vegan,Yet another disgusting bacon page suggested on my feed. But this time I decided to respond. I'm ready for the cognitive dissonance responses.,https://i.redd.it/m67yee91g5r91.jpg,False
BodyZymurgy,t2_gnazr4md,1664613924,xsq9rp,1,/r/vegan/comments/xsq9rp/etheganism/,1,[removed],vegan,Etheganism,https://www.reddit.com/r/vegan/comments/xsq9rp/etheganism/,True
Beau_zwitsers,t2_sz7cnwii,1664614483,xsqevu,0,/r/vegan/comments/xsqevu/1_month_vegan_challenge/,1,[removed],vegan,1 month vegan challenge,https://www.reddit.com/r/vegan/comments/xsqevu/1_month_vegan_challenge/,True
mastodonj,t2_o57td,1664616178,xsqvc1,1,/r/vegan/comments/xsqvc1/i_have_an_idea_and_just_looking_for_advice_andor/,1,"I make seitan or some other meat alternative weekly. Generally it's just for myself and my house but recently I've started making some for friends and family.

I have MS and am currently disabled and unemployed. So for me, most of my vegan activism occurs online. I live in Ireland.

Here's my Instagram if people want to look at things I've made. (I'm not posting to grab likes, feel free to just look for examples)

instagram.com/mastodonj_vegan

So here's what I'm thinking about:

I don't want to start a business. I don't have time and energy to invest in making it work and I'm also fiercely opposed to the profit motive what with being a raging leftist commie! 🤣

I'm also not interested in running into debt. I'm married with kids and that's a quick road to a divorce! 

So threading that line I was thinking what if I ran a donation based thing?

I want to give people what I make and just cover the costs.

Is there a model out there for this type of activity?

I'm thinking I could put it out there that I'll be in such a location with a car full of vegan food and hand it out to the community. Hopefully vegans would show up but probably more important to nonvegans.

Or would it make more sense to link in with vegan activists. Show up and feed people doing the hard work?

I obviously am still working out the details so just looking for any advice or ideas people have.

TLDR:
I want to give away vegan food and do some good while just covering my costs.",vegan,I have an idea and just looking for advice and/or feedback,https://www.reddit.com/r/vegan/comments/xsqvc1/i_have_an_idea_and_just_looking_for_advice_andor/,True
aaronbrowning79,t2_1f1q5ju9,1664619527,xsrsfq,0,/r/vegan/comments/xsrsfq/jeffrey_dahmer/,1,[removed],vegan,Jeffrey Dahmer,https://www.reddit.com/r/vegan/comments/xsrsfq/jeffrey_dahmer/,True
aboobool68,t2_9v4nlehu,1664622574,xssmky,1,/r/vegan/comments/xssmky/heeeey_newbie_here/,1,[removed],vegan,"Heeeey, newbie here",https://www.reddit.com/r/vegan/comments/xssmky/heeeey_newbie_here/,True
ennoLio,t2_pdp30kbd,1664623781,xssyna,0,/r/vegan/comments/xssyna/achtung_e471/,1,Gefunden in unscheinbaren Ikea Knäckebrot,vegan,Achtung E471,https://www.reddit.com/gallery/xssyna,False
eruannie,t2_2dh1i584,1664624389,xst52a,1,/r/vegan/comments/xst52a/substitutes_for_yogurt/,1,"I’m used to eat Greek yogurt everyday for breakfast, and I’m having an hard time finding some vegan alternatives. Vegan yogurts are not suitable for me because (at least where I live) are very expensive, especially if I plan to eat it everyday, it’s not sustainable for a college student on a budget. Also they don’t have enough protein, and for me it’s very important to eat a protein packed breakfast because it keeps me full for longer and I feel more energised eating that rather than mostly carbs. Also I work out a lot and I like to eat a bit of protein in every meal. 
I usually eat Greek yogurt mixed with oats and some topping. 
Any suggestions for alternatives that are relatively cheap and full of protein? Any kind of food it’s okay, it does not have to be similar to my current breakfast.
Also I’ve tried many different vegan protein powders and they were all disgusting, there were no way of masking the flavour, and I tried very very hard, mixing them with various things.",vegan,Substitutes for yogurt?,https://www.reddit.com/r/vegan/comments/xst52a/substitutes_for_yogurt/,True
Jonn_1,t2_8vxulpf5,1664625864,xstl9d,1,/r/vegan/comments/xstl9d/thoughts_anyone_had_this_b4/,1,,vegan,thoughts? anyone had this b4?,https://i.redd.it/uv5irqftp6r91.jpg,False
CANGIUZ04,t2_4urw0379,1664627578,xsu5gg,1,/r/vegan/comments/xsu5gg/craig_animalbased_autoimmune_expert_on_instagram/,1,,vegan,"Craig | Animal-Based Autoimmune Expert on Instagram: ""Follow me for more animal-based health tips! 🤙🏽 There is no such thing as a bloodless diet… Yellowstone is constantly dropping gems 💎 I come into this conversation with compassion and understanding. My sole intent is to help people who are hur",https://www.instagram.com/reel/Chw_2FPjY3o/?igshid=MDJmNzVkMjY=,False
THothersall,t2_lt9dltw7,1664628143,xsuc9n,1,/r/vegan/comments/xsuc9n/do_you_actively_avoid_foods_containing_palm_oil/,1,"Hi everyone.

I  am currently in need of Vegans currently living in the UK to answer a  short ***2-3 minute*** online questionnaire for my plant-based PhD  study/thesis, titled: **Palmitic acid (16:0) consumption in plant-based diets and its effect on metabolic health.**   I really want to further plant-based research and make a massive   contribution to the field, if you can assist me with this, that would be   awesome!

[https://uclan.eu.qualtrics.com/jfe/form/SV\_3ezZLJjHIY0a2uG](https://uclan.eu.qualtrics.com/jfe/form/SV_3ezZLJjHIY0a2uG)

*Survey is mobile-friendly.*  
*Feel free to leave any questions you are uncomfortable with blank.*  
*Please   provide estimations or leave blank the questions you may not be able  to  answer right now, such as waist/hip circumference.*  
***Sometimes the link displays incorrectly on Reddit, please comment if you have this issue.***

I am ending the survey at the end of this week so I am just giving it one more push!  
If you have any questions, I will be more than happy to answer them :)

Best wishes and thank you very much,  
Thomas  
\-----

*Additonal information for those interested:*  
*Palm   oil is in  over 50% of products found throughout the UK and is heavily   processed in  the western diet, this could reasonably be seen as a  huge  health risk.*  
*This   research  is a small part of my PhD but a very important one, I am   looking at the  awareness of palm oil and palmitic acid throughout the  UK  with a focus  on the differences based on age, ethnicity, body   composition, physical  activity and lifestyle. This will really help  when  I progress to the  next phase(s) of my research. Other aspects of  my  research include a  systematic review with meta-analysis, a fatty  acid  analysis, as well as  blood/stool samples from participants with   differing levels of palm  oil consumption.*  
*We   all know  palm oil is particular bad for the environment (and this  will  be  outlined heavily in my research), however, the main goal(s) of  the   research is to determine 1) if palm oil is healthy/unhealthy, as  the   literature does not provide a concrete answer at this time - or  provides   contradictory statements/findings 2) at what level of  consumption, for   how long a period of time can humans consume palm  oil/palmitic acid   before it becomes a minor, or major health risk, 3)  is it more prevalent   in a vegan diet when compared with omnivore,  vegetarian pescatarian,   flexitarian etc 4) how does it affect brain  function, gut microbiome   diversity, metabolic syndrome/metabolic  health 5) is it beneficial for   some people, for example those with  ADHD (very little science on the   subject currently).*  
*There is a Participant Information Sheet attached within the questionnaire (which covers this particular experiment as a whole).*",vegan,Do you actively avoid foods containing Palm Oil?,https://www.reddit.com/r/vegan/comments/xsuc9n/do_you_actively_avoid_foods_containing_palm_oil/,True
Valuable-Study7299,t2_q9amwn7i,1664628247,xsudj5,1,/r/vegan/comments/xsudj5/the_balut_or_whatever_tiktok_trend_tipped_me_over/,1,"It makes me nauseous to see people eat the poor little babies with feathers and everything. No I'm not disrespecting cultures. In fact this trend reminded me that just because it comes home all cleaned and prepped, it started as a sentient animal. A sheep or a cow or a pig, intelligent, living creatures. They don't deserve to suffer because I want butter on my toast instead of veg spread.",vegan,The balut (?) or whatever tiktok trend tipped me over the edge on veganism,https://www.reddit.com/r/vegan/comments/xsudj5/the_balut_or_whatever_tiktok_trend_tipped_me_over/,True
woodbite,t2_bx7khhsn,1664628329,xsuem8,1,/r/vegan/comments/xsuem8/the_hardest_part_of_going_vegan_was_deciding_to/,1,"I was a vegetarian for 1.5 years. The concept of veganism seemed too extreme. I thought I might as well live in the woods and never pay for clothing or electricity or any pleasures again if I was going to go *such lengths.*

Then I was confronted with my hypocrisy, and after a lifetime of eating habits rooted in cognitive dissonance and buried distress I just- stopped doing it.

Yes, there are some challenges. I already think they're trumped by other challenges in my life, like navigating new responsibilities with my age, getting a job, and driving. The thing that was really, truly testing was *deciding and committing* to veganism when it *seemed* hard and scary. That was the hill. Every meal since has been comparably painless. 

Ethics aside, I have personally gained more in nutrition knowledge, cooking skills, and general independence too! I'm happier, and I feel less hesitant to do ""hard"" things. I'm so grateful to this sub, because it would never have happened without you.",vegan,The hardest part of going vegan was deciding to go vegan.,https://www.reddit.com/r/vegan/comments/xsuem8/the_hardest_part_of_going_vegan_was_deciding_to/,True
veiddys,t2_2mwzeetb,1664629467,xsut73,0,/r/vegan/comments/xsut73/vegan_protein_chart/,1,From “The Great Vegan Protein Book”,vegan,Vegan protein chart,https://i.redd.it/hpdjh44j07r91.jpg,False
Suspicious_Ad6271,t2_9jnpy89d,1664629544,xsuu8a,0,/r/vegan/comments/xsuu8a/have_this_galaxy_hot_chocolate_at_work_not_sure/,1,,vegan,Have this galaxy hot chocolate at work not sure if it is vegan,https://i.redd.it/vcpuwkbq07r91.jpg,False
REALiLikeToucans,t2_krs3x1,1664629914,xsuz3l,1,/r/vegan/comments/xsuz3l/first_time_making_vegan_meatballs/,1,,vegan,First time making vegan meatballs!,https://i.redd.it/i00hx6er17r91.jpg,False
Slaps_115,t2_2slh5usd,1664629924,xsuz91,1,/r/vegan/comments/xsuz91/anyone_good_at_oral_presentations_to_help_me_with/,1,"I'm currently in a communications class and by the end of it I need to do a 15 minute oral presentation on any topic I want. So I thought, why not do some activism by talking about animal rights. I'd like to think I'm pretty clued up on the topic as a vegan for 5 years and I enjoy watching debates on youtube. However, I really want to do it right and I dont want to mess it up and end up looking stupid. Any help would be appreciated, like help with structure in the presentation, which points and subjects to start with, or even just good resources I can use in my presentation would help alot! We also need a visual aid to the presentation like PowerPoint",vegan,Anyone good at Oral Presentations to help me with my project?,https://www.reddit.com/r/vegan/comments/xsuz91/anyone_good_at_oral_presentations_to_help_me_with/,True
veiddys,t2_2mwzeetb,1664629931,xsuzcl,0,/r/vegan/comments/xsuzcl/vegan_protein_chart/,1,From “The Great Vegan Protein Book”,vegan,Vegan protein chart,https://i.redd.it/glagoiiw17r91.jpg,False
Honeymoon_Mindset,t2_hhmg2uvq,1664630838,xsvbay,1,/r/vegan/comments/xsvbay/given_the_choice_of_anyone_in_the_world_whom/,1,[removed],vegan,"Given the choice of anyone in the world, whom would you want as a dinner guest?",https://www.reddit.com/r/vegan/comments/xsvbay/given_the_choice_of_anyone_in_the_world_whom/,True
